title,url,date
"Mañana, último día de la cuenta al 2,89% TAE y depósito al 3,44% TAE de Renault Bank",https://www.tucapital.es/depositos/manana-ultimo-dia-de-la-cuenta-al-289-tae-y-deposito-al-344-tae-de-renault-bank/,23/04/2024
ING te da hasta 120€ si domicilias nómina y pagas con su tarjeta,https://www.tucapital.es/cuentas/ing-te-da-hasta-120e-si-domicilias-nomina-y-pagas-con-su-tarjeta/,22/04/2024
"Depósitos de Banco BIG: ligera subida en los normales, y combinados 5,06% TAE",https://www.tucapital.es/depositos/depositos-de-banco-big-ligera-subida-los-normales-y-combinados-506-tae/,22/04/2024
El futuro de Bitcoin: predicciones para los próximos 5 años,https://www.tucapital.es/blogs/guias/el-futuro-de-bitcoin-predicciones-para-los-proximos-5-anos/,22/04/2024
Eco: Cetelem sólo permite transferencias máximas diarias de 30.000€,https://www.tucapital.es/blogs/eco/eco-cetelem-solo-permite-transferencias-maximas-diarias-de-30-000e/,19/04/2024
"B100, otra alternativa decente a Orange Bank: cuenta sin comisiones al 2,7% TAE",https://www.tucapital.es/cuentas/b100-otra-alternativa-decente-a-orange-bank/,18/04/2024
"Banca March sube su Depósito Flexible Avantio hasta el 3,1% TAE",https://www.tucapital.es/depositos/banca-march-sube-su-deposito-flexible-avantio-hasta-el-31-tae/,17/04/2024
"¿Merece la pena el 3,25% TAE de Cetelem? ¿Es mejor que Orange Bank?",https://www.tucapital.es/cuentas/merece-la-pena-el-325-tae-de-cetelem-es-mejor-que-orange-bank/,16/04/2024
¿Cómo hago para pasar de Orange Bank a Cetelem?,https://www.tucapital.es/cuentas/como-hago-para-pasar-de-orange-bank-a-cetelem/,16/04/2024
"Oferta especial de Cetelem a clientes de Orange Bank, 3,25% TAE",https://www.tucapital.es/cuentas/oferta-especial-de-cetelem-a-clientes-de-orange-bank-325-tae/,15/04/2024
Orange Bank cerrará sus servicio bancarios el 17 de junio de 2024,https://www.tucapital.es/cuentas/orange-bank-cerrara-sus-servicio-bancarios-el-17-de-junio-de-2024/,15/04/2024
Eco: Sabadell retira el plan amigo sin informar a los clientes y antes de plazo,https://www.tucapital.es/blogs/eco/eco-sabadell-retira-el-plan-amigo-sin-informar-a-los-clientes-y-antes-de-plazo/,15/04/2024
Navegando las finanzas en el mundo del entretenimiento online: un vistazo a Rabona Casino,https://www.tucapital.es/blogs/guias/navegando-las-finanzas-en-el-mundo-del-entretenimiento-online-un-vistazo-a-rabona-casino/,15/04/2024
N26 sí que podría ser una gran alternativa a Orange Bank,https://www.tucapital.es/cuentas/n26-si-que-podria-ser-una-gran-alternativa-a-orange-bank/,12/04/2024
"ING relanza su depósito captación: menos rentable, 2,5% TAE; y menos plazo, 3 meses",https://www.tucapital.es/depositos/ing-relanza-su-deposito-dinero-nuevo-pero-menos-rentable-y-por-menos-plazo/,11/04/2024
"Buena noticia, Renault Bank sólo prorroga su Cuenta al 2,89% TAE y Depósito al 3,44% TAE",https://www.tucapital.es/depositos/buena-noticia-renault-bank-solo-prorroga-su-cuenta-al-289-tae-y-deposito-al-344-tae/,11/04/2024
"Alternativas a Orange Bank, nada será tan bueno",https://www.tucapital.es/cuentas/alternativas-a-orange-bank-nada-sera-tan-bueno/,10/04/2024
Orange Bank ya no permite contratar su cuenta. ¿Qué va a pasar?,https://www.tucapital.es/cuentas/orange-bank-ya-no-permite-contratar-su-cuenta-que-va-a-pasar/,09/04/2024
"Openbank vuelve a ofrecer un depósito al 3,15% TAE y a 12 meses con el truco de amago",https://www.tucapital.es/depositos/openbank-vuelve-a-ofrecer-un-deposito-al-315-tae-y-a-12-meses-con-el-truco-de-amago/,08/04/2024
"EBN Banco ha prorrogado por tiempo indefinido sus depósitos al 3,1% TAE",https://www.tucapital.es/depositos/ebn-banco-ha-prorrogado-por-tiempo-indefinido-sus-depositos-al-31-tae/,08/04/2024
"Encuesta Renault Bank: Cuenta 2,89% TAE; depósito 3,44% TAE. ¿Subirán o bajarán?",https://www.tucapital.es/depositos/encuesta-renault-bank-cuenta-289-tae-deposito-344-tae-subiran-o-bajaran/,05/04/2024
"Haitong baja sus depósitos a 6 y 9 meses. Conserva el máximo del 3,55% TAE",https://www.tucapital.es/depositos/haitong-baja-sus-depositos-a-6-y-9-meses-conserva-el-maximo-del-355-tae/,04/04/2024
Hacemos eco de: Openbank no cumple promoción de incremento de saldo,https://www.tucapital.es/blogs/eco/hacemos-eco-de-openbank-no-cumple-promocion-de-incremento-de-saldo/,04/04/2024
¿Tengo la obligación de presentar la declaración? ¿Conviene hacer algo si estoy exento?,https://www.tucapital.es/blogs/noticias/tengo-que-hacer-la-declaracion-puedo-presentarlo-si-me-sale-a-devolver/,03/04/2024
Hoy arranca Renta 2023. Fechas a tener en cuenta,https://www.tucapital.es/blogs/noticias/hoy-arranca-renta-2023-fechas-a-tener-en-cuenta/,03/04/2024
"Banco BIG baja sus depósitos de clientes, mantiene al 4,1% TAE el de bienvenida",https://www.tucapital.es/depositos/banco-big-baja-sus-depositos-de-clientes-mantiene-al-41-tae-el-de-bienvenida/,03/04/2024
MyInvestor sigue ofreciendo sus depósitos al 3% TAE hasta finales de Abril,https://www.tucapital.es/depositos/myinvestor-sigue-ofreciendo-sus-depositos-al-3-tae-hasta-finales-de-abril/,02/04/2024
Descubre la diversidad de juegos en línea con Nomini Casino,https://www.tucapital.es/blogs/guias/descubre-la-diversidad-de-juegos-en-linea-con-nomini-casino/,02/04/2024
"Los depósitos de Cetelem, hasta 4% TAE, serían interesantes si no fuera por su cuenta",https://www.tucapital.es/depositos/los-depositos-de-cetelem-hasta-4-tae-serian-interesantes-si-no-fuera-por-su-cuenta/,01/04/2024
"BBVA Italia baja su depósito Flexible al 3% TAE, y la cuenta sigue al 4% TAE",https://www.tucapital.es/depositos/bbva-italia-baja-su-deposito-flexible-al-3-tae-y-la-cuenta-sigue-al-4-tae/,27/03/2024
"ING recorta un poco más la rentabilidad de sus depósitos Naranja, hasta el 2,40% TAE",https://www.tucapital.es/depositos/ing-recorta-un-poco-mas-la-rentabilidad-de-sus-depositos-naranja-hasta-el-240-tae/,26/03/2024
"CA Auto Bank sube ligeramente la rentabilidad de sus depósitos, hasta 3,55% TAE",https://www.tucapital.es/blogs/noticias/ca-auto-bank-sube-ligeramente-la-rentabilidad-de-sus-depositos/,25/03/2024
"Revolut ahora «da» el 3,97% TAE en su Cuenta Flexible",https://www.tucapital.es/cuentas/revolut-ahora-da-el-397-tae-en-su-cuenta-flexible/,25/03/2024
"La próxima semana, la última para presentar el Modelo 720",https://www.tucapital.es/blogs/noticias/la-proxima-semana-la-ultima-para-presentar-el-modelo-720-si-has-tenido-dinero-en-el-extranjero/,21/03/2024
"Nueva prórroga sin cambios en Renault Bank: Cuenta al 2,89% TAE y Depósito al 3,44% TAE",https://www.tucapital.es/depositos/nueva-prorroga-sin-cambios-en-renault-bank-cuenta-al-289-tae-y-deposito-al-344-tae/,21/03/2024
"Cajamar: depósito al 3% TAE si dinero nuevo o al 2% TAE y cuenta al 2,52% TAE",https://www.tucapital.es/depositos/cajamar-deposito-dinero-nuevo-al-3-tae-o-al-2-tae-y-cuenta-al-252-tae/,20/03/2024
Ya puedes consultar tus datos fiscales de la Declaración de la Renta 2023 – 2024,https://www.tucapital.es/blogs/noticias/ya-puedes-consultar-tus-datos-fiscales-de-la-declaracion-de-la-renta-2023-2024/,20/03/2024
Disponible Renta Web Open 2024: podrás simular si te tocará pagar o devolver y cuánto,https://www.tucapital.es/blogs/noticias/renta-web-open-con-este-simulador-podras-saber-si-te-toca-pagar-o-devolver-y-cuanto/,20/03/2024
5 señales que indican que un casino vale la pena,https://www.tucapital.es/blogs/guias/5-senales-que-indican-que-un-casino-vale-la-pena/,20/03/2024
2 semanas más para conseguir 400€ en efectivo a cambio de nómina y 2 recibos en Santander,https://www.tucapital.es/depositos/2-semanas-mas-para-conseguir-400e-por-nomina-y-2-recibos-en-santander/,19/03/2024
La próxima semana vence la oferta al 3% TAE de los depósito de MyInvestor,https://www.tucapital.es/depositos/la-proxima-semana-vence-la-oferta-al-3-tae-de-los-deposito-de-myinvestor/,18/03/2024
"Deutsche Bank mejora su oferta para captar nómina: 360€ + 2,5% TAE",https://www.tucapital.es/cuentas/deutsche-bank-mejora-su-oferta-para-captar-nomina-360e-25-tae/,18/03/2024
"Arquia ahora ofrece un depósito al 3,5% TAE a 6 meses, medio puntos menos",https://www.tucapital.es/depositos/arquia-ahora-ofrece-un-deposito-al-35-tae-a-6-meses-medio-puntos-menos/,14/03/2024
"Última semana de Renault Bank: Cuenta al 2,89% TAE y Depósito al 3,44% TAE",https://www.tucapital.es/depositos/ultima-semana-de-renault-bank-cuenta-al-289-tae-y-deposito-al-344-tae/,14/03/2024
Los 720€ de bonificación por recibos de BBVA terminará el 31 de marzo,https://www.tucapital.es/cuentas/los-720e-de-bonificacion-por-recibos-de-bbva-terminara-el-31-de-marzo/,13/03/2024
"Depósito Flexible Avantio de Banca March a 12 meses y al 3% TAE, 1 mes más",https://www.tucapital.es/depositos/deposito-flexible-avantio-de-banca-march-a-12-meses-y-al-3-tae-1-mes-mas/,12/03/2024
"¿Qué documentos necesito para la Renta 2023, especialmente si pides cita previa?",https://www.tucapital.es/blogs/noticias/que-documentos-necesito-para-renta-2023-especialmente-si-pides-cita-previa/,12/03/2024
"Los depósitos de Evo Banco para clientes, hasta 2,95% TAE para dinero nuevo",https://www.tucapital.es/depositos/los-depositos-de-evo-banco-para-clientes-hasta-295-tae-para-dinero-nuevo/,11/03/2024
Bankinter lanza una cuenta remunerada al 3% TAE para las Pymes,https://www.tucapital.es/cuentas/bankinter-lanza-una-cuenta-remunerada-al-3-tae-para-las-pymes/,08/03/2024
"Orange Bank será Cetelem, ¿Cómo acabará? ¿qué pasará con MoneyGo-Cetelem?",https://www.tucapital.es/cuentas/orange-bank-sera-cetelem-que-pasara-con-moneygo-cetelem/,07/03/2024
"Wizink sube, si SUBE la rentabilidad de sus depósitos hasta el 3% TAE",https://www.tucapital.es/depositos/wizink-sube-si-sube-la-rentabilidad-de-sus-depositos-hasta-el-3-tae/,07/03/2024
"Banco BIG baja ligeramente su Gran Depósito de bienvenida hasta el 4,1% TAE",https://www.tucapital.es/depositos/banco-big-baja-ligeramente-su-gran-deposito-de-bienvenida-hasta-el-41-tae/,06/03/2024
"Abanca crea B100 con una cuenta al 3,4% TAE, sustituto perfecto de Orange Bank",https://www.tucapital.es/cuentas/abanca-crea-b100-con-una-cuenta-al-34-tae-siempre-que-cuides-de-tu-salud/,05/03/2024
"Pibank mejora su cuenta nómina si pones más de 5.000€ en ella, hasta 2,5% TAE",https://www.tucapital.es/cuentas/pibank-mejora-su-cuenta-nomina-si-pones-mas-de-5-000e-en-ella-hasta-25-tae/,05/03/2024
"ING baja de nuevo sus depósitos Naranja, ahora hasta el el 2,55% TAE",https://www.tucapital.es/depositos/ing-baja-de-nuevo-sus-depositos-naranja-ahora-hasta-el-el-255-tae/,04/03/2024
"Wizink prorroga sus depósitos sólo por 4 días, ¿viene bajada?",https://www.tucapital.es/depositos/wizink-prorroga-sus-depositos-solo-por-4-dias-viene-bajada/,01/03/2024
"Se terminó el 6% TAE inicial del Sabadell, ahora al 2% TAE para todos",https://www.tucapital.es/cuentas/se-termino-el-6-tae-inicial-del-sabadell-ahora-al-2-tae-para-todos/,01/03/2024
"Cetelem lanza un depósito al 4% TAE, la pega su cuenta de hasta al 3% TAE",https://www.tucapital.es/depositos/cetelem-lanza-un-deposito-al-4-tae-la-pega-su-cuenta-de-hasta-al-3-tae/,29/02/2024
"CA Auto Bank reactiva sus depósitos, pero a un interés bastante inferior",https://www.tucapital.es/depositos/ca-auto-bank-reactiva-sus-depositos-pero-a-un-interes-bastante-inferior/,28/02/2024
"Otro recorte más de Haitong sobre sus depósitos, ahora hasta el 3,55% TAE",https://www.tucapital.es/depositos/otro-recorte-mas-de-haitong-sobre-sus-depositos-ahora-hasta-el-355-tae/,28/02/2024
¿Cuál es la Casilla clave para acceder a tu borrador y Renta Web 2024?,https://www.tucapital.es/blogs/noticias/cual-es-la-casilla-clave-para-acceder-a-tu-borrador-y-renta-web-2024/,28/02/2024
"Confirmado, Orange Bank será Cetelem",https://www.tucapital.es/cuentas/confirmado-orange-bank-sera-cetelem/,27/02/2024
"Banca March relanza su Depósito Flexible Avantio, a 12 meses y ahora al 3% TAE",https://www.tucapital.es/depositos/banca-march-relanza-su-deposito-flexible-avantio-a-12-meses-y-ahora-al-3-tae/,27/02/2024
Calendario de IRPF 2023: fechas claves de la declaración de la renta,https://www.tucapital.es/blogs/noticias/calendario-de-irpf-2023-fechas-claves-de-la-declaracion-de-la-renta/,27/02/2024
Santander continua dando 400€ por una nómina y 2 recibos hasta abril de 2024,https://www.tucapital.es/cuentas/santander-continua-dando-400e-por-una-nomina-y-2-recibos-hasta-abril-de-2024/,26/02/2024
"Openbank ahora ya solo ofrece un depósito al 2,00% TAE y a 12 meses con el truco de amago",https://www.tucapital.es/depositos/openbank-ahora-ya-solo-ofrece-un-deposito-al-200-tae-y-a-12-meses-con-el-truco-de-amago/,26/02/2024
"Novum Bank ofrece 2 depósitos a 6 y 12 meses y al 3,5 y 3,9% TAE",https://www.tucapital.es/depositos/novum-bank-ofrece-2-depositos-a-6-y-12-meses-y-al-35-y-39-tae/,23/02/2024
"Nuevo depósito Maxi de BFS al 3,6% TAE para un mínimo de 100.000€",https://www.tucapital.es/depositos/nuevo-deposito-maxi-de-bfs-36-tae-para-un-minimo-de-100-000e/,23/02/2024
Entendiendo el rendimiento de las acciones de las empresas tecnológicas en 2024,https://www.tucapital.es/blogs/guias/entendiendo-el-rendimiento-de-las-acciones-de-las-empresas-tecnologicas-en-2024/,23/02/2024
Orange Bank seguramente será Cetelem y será una «buena noticia»,https://www.tucapital.es/cuentas/orange-bank-sera-lo-mas-seguro-cetelem-y-es-una-buena-noticia/,22/02/2024
Otro pequeño recorte en la rentabilidad de los depósitos de BFS,https://www.tucapital.es/depositos/otro-pequeno-recorte-en-la-rentabilidad-de-los-depositos-de-bfs/,22/02/2024
"MyInvestor sube la rentabilidad de su depósito a 3 meses, ahora todos al 3% TAE",https://www.tucapital.es/depositos/myinvestor-sube-la-rentabilidad-de-su-deposito-a-3-meses-ahora-todos-al-3-tae/,22/02/2024
"Ya empezamos: Banco BIG, 5% TAE; MyInvestor 4% TAE, con los peros de siempre",https://www.tucapital.es/depositos/ya-empezamos-banco-big-5-tae-myinvestor-4-tae-con-los-peros-de-siempre/,21/02/2024
"2 semanas más para contratar el depósito al 3,44% y cuenta al 2,89% TAE de Renault Bank",https://www.tucapital.es/depositos/2-semanas-mas-para-contratar-el-deposito-al-344-y-cuenta-al-289-tae-de-renault-bank/,21/02/2024
Pichincha mantiene la rentabilidad de sus productos a pesar de la bajada de Pibank,https://www.tucapital.es/depositos/pichincha-mantiene-la-rentabilidad-de-sus-productos-a-pesar-de-la-bajada-de-pibank/,20/02/2024
"BAI Europa ya sólo ofrece el 3,6% TAE a 6 y 12 meses",https://www.tucapital.es/depositos/bai-europa-ya-solo-ofrece-el-36-tae-a-6-y-12-meses/,19/02/2024
"Bank Norwegian sube hasta 3,7% TAE la rentabilidad su Cuenta de Ahorro",https://www.tucapital.es/cuentas/bank-norwegian-sube-hasta-37-tae-la-rentabilidad-su-cuenta-de-ahorro-2/,16/02/2024
"Cuenta Ahorro de Wizink al 2,3% TAE para todos los clientes. ¿Merece la pena?",https://www.tucapital.es/cuentas/cuenta-ahorro-de-wizink-al-23-tae-para-todos-los-clientes-merece-la-pena/,16/02/2024
"EBN Banco pone todos sus depósitos al 3,1% TAE, sólo has de elegir plazo",https://www.tucapital.es/depositos/ebn-banco-pone-todos-su-depositos-al-31-tae-solo-has-de-elegir-plazo/,15/02/2024
Las transferencias inmediatas costará lo mismo que las normales,https://www.tucapital.es/blogs/noticias/las-transferencias-inmediatas-costara-lo-mismo-que-las-normales/,15/02/2024
Nueva prórroga de la Cuenta Online al 6% TAE durante 3 meses del Sabadell,https://www.tucapital.es/cuentas/nueva-prorroga-de-la-cuenta-online-al-6-tae-durante-3-meses-del-sabadell/,15/02/2024
BFS recorta un poco más la rentabilidad de sus depósitos,https://www.tucapital.es/depositos/bfs-recorta-un-poco-mas-la-rentabilidad-de-sus-depositos/,14/02/2024
"Wizink dará a partir de mañana al 2,3% TAE las cuentas NO vinculadas a depósitos",https://www.tucapital.es/cuentas/wizink-dara-a-partir-de-manana-al-23-tae-las-cuentas-no-vinculadas-a-depositos/,14/02/2024
"Ni rastro del depósito bienvenida y de incremento de saldo al 2,75% TAE de ING",https://www.tucapital.es/depositos/ni-rastro-del-deposito-bienvenida-y-de-incremento-de-saldo-al-275-tae-de-ing/,13/02/2024
Wizink por fin sube hasta el 1% TAE las antiguas cuentas ahorro,https://www.tucapital.es/cuentas/wizink-por-fin-sube-hasta-el-1-tae-las-antiguas-cuentas-ahorro/,13/02/2024
¿Banco Pichincha bajará también la rentabilidad de su depósito como Pibank?,https://www.tucapital.es/depositos/banco-pichincha-bajara-tambien-su-cuenta-y-deposito/,12/02/2024
"2 últimos días que estará el depósito de Pibank al 3,34% TAE, luego al 3,14% TAE",https://www.tucapital.es/depositos/2-ultimos-dias-que-estara-el-deposito-de-pibank-al-334-tae-luego-al-314-tae/,12/02/2024
"Otro tijeretazo de Haitong sobre sus depósitos hasta el 3,7% TAE",https://www.tucapital.es/depositos/otro-tijeretazo-de-haitong-sobre-sus-depositos-hasta-el-37-tae/,09/02/2024
Deutsche Bank te ofrece en su cuenta Más DB 360€ por nómina y/o 2% TAE 1 año,https://www.tucapital.es/cuentas/deutsche-bank-te-ofrece-en-su-cuenta-mas-db-360e-por-nomina-y-o-2-tae-1-ano/,08/02/2024
"Orange Bank España podría ser de BNP, Deutsche Bank o Morgan Stanley",https://www.tucapital.es/cuentas/orange-bank-espana-podria-ser-de-bnp-deutsche-bank-o-morgan-stanley/,07/02/2024
"Renault Bank solo prorroga sus productos 2 semanas: Depósito al 3,44% y cuenta al 2,89% TAE",https://www.tucapital.es/depositos/renault-bank-solo-prorroga-sus-productos-2-semanas-deposito-al-344-y-cuenta-al-289-tae/,07/02/2024
"Evo Banco ofrece ahora sólo un depósito a 6 meses y al 2,85% TAE",https://www.tucapital.es/depositos/evo-banco-ofrece-ahora-solo-un-deposito-a-6-meses-y-al-285-tae/,06/02/2024
¿Dinero en Raisin en 2023? Obligado a hacer la declaración aunque estuvieras exento,https://www.tucapital.es/blogs/noticias/dinero-en-raisin-en-2023-obligado-a-hacer-la-declaracion-aunque-estuvieras-exento/,05/02/2024
CA Auto Bank pone en standby sus depósitos y baja el tipo de interés hasta el 4% TAE,https://www.tucapital.es/depositos/ca-auto-bank-pone-en-standby-sus-depositos-y-baja-el-tipo-de-interes/,05/02/2024
"Openbank ofrece un depósito al 3,15% TAE y a 12 meses con el truco de amago",https://www.tucapital.es/depositos/openbank-ofrece-un-deposito-al-315-tae-y-a-12-meses-con-el-truco-de-amago/,02/02/2024
"Tijeretazo en BAI Europa: baja del 4,2% TAE hasta el 3,8% TAE",https://www.tucapital.es/depositos/tijeretazo-en-bai-europa-baja-del-42-tae-hasta-el-38-tae/,02/02/2024
MyInvestor prorroga por 1 mes más sus depósitos sin cambios: hasta 3% TAE,https://www.tucapital.es/depositos/myinvestor-prorroga-por-1-mes-mas-sus-depositos-sin-cambios-hasta-3-tae/,01/02/2024
"Nuevo recorte del Banco BIG a sus depósitos sin exigencias: ahora 3,5% TAE máximo",https://www.tucapital.es/depositos/nuevo-recorte-del-banco-big-a-sus-depositos-sin-exigencias-ahora-35-tae-maximo/,01/02/2024
"ING prorroga hasta el 11 de febrero su depósito a 4 meses y al 2,75% TAE",https://www.tucapital.es/depositos/ing-prorroga-hasta-el-11-de-febrero-su-deposito-al-275-tae/,31/01/2024
"OCU insta a BBVA que permita a los españoles contratar su depósito al 4,25% de Italia",https://www.tucapital.es/depositos/ocu-insta-a-bbva-que-permita-a-los-espanoles-contratar-su-deposito-al-425-de-italia/,31/01/2024
"BluOr Bank AS sube su depósito a 1 año desde el 3,45% TAE hasta el 3,80%  TAE",https://www.tucapital.es/depositos/bluor-bank-as-sube-su-deposito-a-1-ano-desde-el-345-tae-hasta-el-380-tae/,30/01/2024
Sabadell prorroga hasta el 14 de febrero su Cuenta Online al 6% TAE durante 3 meses,https://www.tucapital.es/cuentas/sabadell-prorroga-hasta-el-14-de-febrero-su-cuenta-online-al-6-tae/,30/01/2024
"Ofertas que vencen ahora en Enero: Sabadell, ING y MyInvestor",https://www.tucapital.es/depositos/ofertas-que-vencen-ahora-en-enero-sabadell-ing-y-myinvestor/,29/01/2024
"Wizink mantendrá sin cambios sus depósitos en febrero, pero poco rentables: 2,5% TAE",https://www.tucapital.es/depositos/wizink-mantendra-sin-cambios-sus-depositos-en-febrero-pero-poco-rentables-25-tae/,26/01/2024
"¿Interesado en depósitos de Raisin? BAI Europa son los que mas dan, 4,2% TAE",https://www.tucapital.es/depositos/interesado-en-depositos-de-raisin-bai-europa-son-los-que-mas-dan-42-tae/,25/01/2024
"Auto Bank, de Crédit Agricole, lanza depósitos de hasta 4,2% TAE",https://www.tucapital.es/depositos/auto-bank-de-credit-agricole-lanza-depositos-de-hasta-42-tae/,24/01/2024
"BBVA te paga todos tus recibos que domicilies durante 1 año, hasta 720€",https://www.tucapital.es/cuentas/bbva-te-paga-todos-tus-recibos-que-domicilies-durante-1-ano-hasta-720e/,24/01/2024
"CBNK lanza el Depósito Transparente al 3,29% TAE y a 6 meses de plazo",https://www.tucapital.es/depositos/cbnk-lanza-el-deposito-transparente-al-329-tae-y-a-6-meses-de-plazo/,24/01/2024
"Bank Norwegian SUBE hasta 3,7% TAE la rentabilidad su Cuenta de Ahorro",https://www.tucapital.es/cuentas/bank-norwegian-sube-hasta-37-tae-la-rentabilidad-su-cuenta-de-ahorro/,23/01/2024
Tijeretazo de Haitong sobre todos sus depósitos y pierde la cota del 4% TAE,https://www.tucapital.es/depositos/tijeretazo-de-haitong-sobre-todos-sus-depositos-y-pierde-la-cota-del-4-tae/,22/01/2024
Última semana para contratar la Cuenta Online del Sabadell al 6% TAE durante 3 meses,https://www.tucapital.es/cuentas/ultima-semana-para-contratar-la-cuenta-online-del-sabadell-al-6-tae-durante-3-meses/,22/01/2024
"ING recorta la rentabilidad de los depósitos Naranja, ya no llega al 3% TAE",https://www.tucapital.es/depositos/ing-recorta-la-rentabilidad-de-los-depositos-naranja-ya-no-llega-al-3-tae/,19/01/2024
"Haitong bajará el próximo lunes su depósito a 1 año hasta el 3,95% TAE",https://www.tucapital.es/depositos/haitong-bajara-el-proximo-lunes-su-deposito-a-1-ano-hasta-el-395-tae/,19/01/2024
Alternativas interesantes de inversión para considerar en este 2024,https://www.tucapital.es/blogs/guias/alternativas-interesantes-de-inversion-para-considerar-en-este-2024/,19/01/2024
"ING ofrece incluso un 3,1% TAE si amagas una transferencia",https://www.tucapital.es/depositos/ing-ofrece-incluso-un-31-tae-si-amagas-una-transferencia/,18/01/2024
"Nueva gama de depósitos de Openbank: con nómina, dinero nuevo y para todos",https://www.tucapital.es/depositos/nueva-gama-de-depositos-de-openbank-con-nomina-dinero-nuevo-y-para-todos/,17/01/2024
Ahora con el truco de amago en ING te da un 3% TAE a 6 meses,https://www.tucapital.es/depositos/ahora-con-el-truco-de-amago-en-ing-te-da-un-3-tae-a-6-meses/,16/01/2024
"Renault Bank recorta su depósito desde el 3,85% TAE hasta el 3,44% TAE",https://www.tucapital.es/depositos/renault-bank-recorta-su-deposito-desde-el-385-tae-hasta-el-344-tae/,16/01/2024
"Pibank bajará la rentabilidad de su depósito hasta el 3,1%  TAE en San Valentín",https://www.tucapital.es/depositos/pibank-bajara-la-rentabilidad-de-su-deposito-hasta-el-31-tae-en-san-valentin/,15/01/2024
"Encuesta Renault Bank: Cuenta 2,89% TAE; depósito 3,85% TAE. ¿Subirán o bajarán?",https://www.tucapital.es/depositos/renault-bank-cuenta-289-tae-deposito-385-tae-subira-o-bajara-la-proxima-semana/,12/01/2024
"Haitong bajará mañana su depósito a 2 años hasta el 4% TIN, 0,25 puntos menos",https://www.tucapital.es/depositos/haitong-bajara-manana-su-deposito-a-2-anos-hasta-el-4-tin/,11/01/2024
¿Cómo rellenar el modelo 720 si sólo has tenido depósitos en bancos extranjeros?,https://www.tucapital.es/blogs/como-rellenar-el-modelo-720-si-solo-has-tenido-depositos-en-bancos-extranjeros/,10/01/2024
"Modelo 720: a presentar antes de 1 de abril, si has tenido dinero en el extranjero en 2023",https://www.tucapital.es/blogs/modelo-720-a-presentar-antes-de-1-de-abril-si-has-tenido-dinero-en-el-extranjero-en-2023/,09/01/2024
"Self Bank ofrece depósitos de hasta el 3,3% TAE para todos los clientes",https://www.tucapital.es/depositos/self-bank-ofrece-depositos-de-hasta-el-33-tae-para-todos-los-clientes/,09/01/2024
"Vuelven los depósitos NO cancelables de BFS, y baja de nuevo los cancelables",https://www.tucapital.es/depositos/vuelven-los-depositos-no-cancelables-de-bfs-y-baja-de-nuevo-los-cancelables/,09/01/2024
"Haitong 4,22% TAE, cada días más interesante ante las bajadas de tipos",https://www.tucapital.es/depositos/haitong-422-tae-cada-dias-mas-interesante-ante-las-bajadas-de-tipos/,08/01/2024
Facto baja la rentabilidad absolutamente de TODOS sus depósitos,https://www.tucapital.es/depositos/facto-baja-la-rentabilidad-absolutamente-de-todos-sus-depositos/,05/01/2024
"BFS elimina sus depósitos más rentables, los NO concelables, y baja ligeramente los otros",https://www.tucapital.es/depositos/bfs-elimina-sus-depositos-mas-rentables-lo-no-concelables-y-baja-ligeramente-los-otros/,04/01/2024
"Banco BIG también baja su depósito a 3 meses desde el 4% TAE hasta el 3,75% TAE",https://www.tucapital.es/depositos/banco-big-tambien-baja-su-deposito-a-3-meses-desde-el-4-tae-hasta-el-375-tae/,03/01/2024
Sabadell sigue hasta el 29 de enero ofreciéndote un 6% TAE durante 3 meses,https://www.tucapital.es/cuentas/sabadell-sigue-hasta-el-29-de-enero-ofreciendote-un-6-tae-durante-3-meses/,03/01/2024
Depósitos de MyInvestor siguen sin cambios en enero de 2024: hasta 3% TAE,https://www.tucapital.es/cuentas/depositos-de-myinvestor-siguen-1-mes-mas-de-hasta-3-tae/,02/01/2024
-28/12/2023:,,28/12/2023
Última semana para contratar la cuenta al 6% TAE durante 3 meses de Sabadell,https://www.tucapital.es/cuentas/ultima-semana-para-contratar-la-cuenta-al-6-tae-durante-3-meses-de-sabadell/,27/12/2023
Tu nómina de al menos 900€ vale 120€ para Openbank,https://www.tucapital.es/cuentas/tu-nomina-de-al-menos-900e-vale-120e-para-openbank/,26/12/2023
