title,url,date
«Tu Cuenta NARANJA vuelve a darte más por tus ahorros». ¿Aceptamos pulpo?,https://www.tucapital.es/cuentas/tu-cuenta-naranja-vuelve-a-darte-mas-por-tus-ahorros-aceptamos-pulpo/,23/09/2022
Última semana para conseguir 100€ en Cheque Amazon si contratas 1 tarjeta Wizink,https://www.tucapital.es/blogs/noticias/ultima-semana-para-conseguir-100e-en-cheque-amazon-si-contratas-1-tarjeta-wizink/,22/09/2022
"La Cuenta Naranja de ING vuelverá a remunerar tu dinero, pero sólo al 0,3% TAE",https://www.tucapital.es/cuentas/ing-vuelve-a-remunerar-tu-dinero-pero-solo-al-03-tae/,21/09/2022
Últimos días de los 100€ por nómina de la Cuenta Online del Banco Santander,https://www.tucapital.es/cuentas/ultimos-dias-de-los-100e-por-nomina-de-la-cuenta-online-del-banco-santander/,21/09/2022
"Sin calificativos con Renault Bank: 1% TAE en cuenta y 1,81% TAE en depósito",https://www.tucapital.es/depositos/sin-calificativo-con-renault-bank-1-tae-en-cuenta-y-181-tae-en-deposito/,20/09/2022
"Orange Bank ya anuncia en su web su próximo tipo de interés en su cuenta: 0,7% TAE",https://www.tucapital.es/cuentas/orange-bank-ya-anuncia-en-su-web-su-proximo-tipo-de-interes-en-su-cuenta-07-tae/,19/09/2022
"Subidón de la rentabilidad de los depósitos entre 1 y 2 años en BFS, hasta 1,25%",https://www.tucapital.es/depositos/subidon-de-la-rentabilidad-de-los-depositos-entre-1-y-2-anos-en-bfs-hasta-125/,16/09/2022
El Banco Sabadell prorroga hasta final de mes su Cuenta Online: 50€ + 1% TAE + 1% TAE,https://www.tucapital.es/cuentas/el-banco-sabadell-prorroga-hasta-final-de-mes-su-cuenta-online-50e-1-tae-1-tae/,16/09/2022
"¿Qué ofrecerá a partir del próximo martes Renault Bank? Ahora: 0,7% y 1,4%  TAE",https://www.tucapital.es/depositos/que-ofrece-a-partir-del-proximo-martes-renault-bank-ahora-07-y-14-tae/,15/09/2022
Banco Mediolanum lanza el depósito más rentable del mercado español: al 2% TAE,https://www.tucapital.es/depositos/banco-mediolanum-lanza-el-deposito-mas-rentable-del-mercado-espanol-al-2-tae/,14/09/2022
"Mañana, último día de la oferta 50€ + 1% TAE + 1% TAE de la Cuenta Online del Sabadell",https://www.tucapital.es/cuentas/manana-ultimo-dia-de-la-oferta-50e-1-tae-1-tae-de-la-cuenta-online-del-sabadell/,14/09/2022
"EBN va por todas, sube sus depósitos SinyCon Plus, hasta el 1,75%  TAE; 1,5% TAE a 1 año",https://www.tucapital.es/depositos/ebn-va-por-todas-sube-sus-depositos-sinycon-plus-hasta-el-175-tae-15-tae-a-1-ano/,13/09/2022
Cuenta Va Contigo de BBVA te regala 150€ por domiciliar la nómina,https://www.tucapital.es/cuentas/cuenta-contigo-de-bbva-te-regala-150e-por-domiciliar-la-nomina/,12/09/2022
"ING sigue centrado en las nóminas, ofrece a sus clientes 120€ por domiciliar una",https://www.tucapital.es/cuentas/ing-sigue-centrado-en-las-nominas-ofrece-a-sus-clientes-120e-por-domiciliar-una/,09/09/2022
"BCE sube el tipo de interés en 0,75%, la mayor de la historia, hasta 1,25%",https://www.tucapital.es/blogs/noticias/bce-sube-el-tipo-de-interes-en-075-la-mayor-de-la-historia-hasta-125/,09/09/2022
ING ofrece su Plan Amigo ING hasta el 30 de septiembre: 40€ de bonificación a cada uno,https://www.tucapital.es/cuentas/ing-ofrece-su-plan-amigo-ing-hasta-el-30-de-septiembre-40e-de-bonificacion-a-cada-uno/,08/09/2022
Las aplicaciones móviles más populares para disfrutar de los juegos de casino online,https://www.tucapital.es/blogs/guias/las-aplicaciones-moviles-mas-populares-para-disfrutar-de-los-juegos-de-casino-online/,08/09/2022
Maravillosas estrategias para la ruleta y cómo utilizarlas,https://www.tucapital.es/blogs/guias/maravillosas-estrategias-para-la-ruleta-y-como-utilizarlas/,08/09/2022
¿Qué le pasa a Wizink? O hace algo o que vaya pensando echar el cierre,https://www.tucapital.es/cuentas/que-le-pasa-a-wizink-o-hace-algo-o-que-vaya-pensando-echar-el-cierre/,07/09/2022
"Cuenta Próxima de TargoBank, otra cuenta al 0,7% TAE con peros.",https://www.tucapital.es/cuentas/cuenta-proxima-de-targobank-otra-cuenta-al-07-tae-con-peros/,06/09/2022
"Orange Bank le echa un pulso a Renault Bank y sube también al 0,7% TAE",https://www.tucapital.es/cuentas/orange-bank-le-echa-un-pulso-a-renault-bank-y-sube-tambien-al-07-tae/,05/09/2022
Wizink sigue dando 100€ en Cheque Amazon si contratas su tarjeta en Septiembre,https://www.tucapital.es/cuentas/wizink-sige-dando-100e-en-cheque-amazon-si-contratas-su-tarjeta-en-septiembre/,02/09/2022
"Renault Bank sube su Cuenta Contigo hasta el 0,7% TAE y por tiempo indefinido",https://www.tucapital.es/cuentas/renault-bank-sube-su-cuenta-contigo-hasta-el-07-tae-y-por-tiempo-indefinido/,01/09/2022
-01/09/2022:,,01/09/2022
"Pibank sube su depósito hasta 1,2%  TAE y su Cuenta Remunerada hasta 0,6% TAE",https://www.tucapital.es/depositos/pibank-sube-su-deposito-hasta-12-tae-y-su-cuenta-remunerada-hasta-06-tae/,01/09/2022
2 grandes ofertas en depósitos y cuentas que terminan hoy. ¿Lo renovarán? ¿Lo mejorarán?,https://www.tucapital.es/cuentas/2-grandes-ofertas-en-depositos-y-cuentas-que-terminan-hoy-lo-renovaran-lo-mejoraran/,31/08/2022
Opebank ofrece nuevamente 40€ por abrir cuenta online sin comisiones,https://www.tucapital.es/cuentas/opebank-ofrece-nuevamente-40e-por-abrir-cuenta-online-sin-comisiones/,30/08/2022
Web y App de Renault Bank fuera de servicio ¿por mantenimiento?,https://www.tucapital.es/cuentas/web-y-app-de-renault-bank-fuera-de-servicio-por-mantenimiento/,29/08/2022
Comparativa de las 4 cuentas más rentables de Agosto de 2022,https://www.tucapital.es/cuentas/comparativa-las-4-cuentas-mas-rentables-de-agosto-de-2022/,25/08/2022
La mejor oferta de Agosto se termina en 1 semana: 2% TAE + 50€ netos de Sabadell,https://www.tucapital.es/blogs/noticias/la-mejor-oferta-de-agosto-se-termina-en-1-semana-2-tae-50e-netos-de-sabadell/,24/08/2022
-24/08/2022:,https://www.tucapital.es/blogs/noticias/la-mejor-oferta-de-agosto-se-termina-en-1-semana-2-tae-50e-netos-de-sabadell/,24/08/2022
Casinos online o apuestas deportivas: ¿Qué prefieren los mexicanos?,https://www.tucapital.es/blogs/guias/casinos-online-o-apuestas-deportivas-que-prefieren-los-mexicanos/,23/08/2022
Última semana para conseguir 100€ en Cheque Amazon contratando 1 tarjeta de Wizink,https://www.tucapital.es/blogs/noticias/ultima-semana-para-conseguir-100e-en-cheque-amazon-contratando-1-tarjeta-de-wizink/,23/08/2022
¿Aún no me ha devuelto Hacienda? Entiende el estado de tu declaración de la renta,https://www.tucapital.es/blogs/noticias/aun-no-me-ha-devuelto-hacienda-entiende-el-estado-de-tu-declaracion-de-la-renta/,22/08/2022
Openbank ofrece ahora un descuento del 2% si compras un Cheque Amazon,https://www.tucapital.es/blogs/noticias/openbank-ofrece-ahora-un-descuento-del-2-si-compras-un-cheque-amazon/,19/08/2022
"Bank Norwegian ofrece ahora su Cuenta de Ahorro al 0,5% TAE como Orange Bank",https://www.tucapital.es/cuentas/bank-norwegian-ofrece-ahora-su-cuenta-de-ahorro-al-05-tae-como-orange-bank/,18/08/2022
"Hoy último día de Twyp de ING, echará el cierre mañana. Tienes 1 mes para retirar tu dinero",https://www.tucapital.es/cuentas/twyp-de-ing-echa-el-cierre-hoy-tienes-1-mes-para-retirar-tu-dinero/,17/08/2022
"¿Con los actuales tipos de interés y Euribor, ING no debería de eliminar las comisiones?",https://www.tucapital.es/cuentas/con-el-actual-tipos-de-interes-ing-no-deberia-eliminar-comisiones/,16/08/2022
Cuenta Online del Sabadell al 2% TAE + 50€ si además domicilias una nómina o 3 recibos,https://www.tucapital.es/cuentas/sabadell-da-1-tae-extra-2-tae-si-ademas-domicilias-una-nomina-o-3-recibos/,15/08/2022
Openbank lanza nuevamente la oferta de 40€ por contratar su cuenta online,https://www.tucapital.es/cuentas/openbank-lanza-nuevamente-la-oferta-de-40e-por-contratar-su-cuenta-online/,11/08/2022
"Plan Amigo BBVA cuenta sin comisiones hasta octubre: 35€, padrino; 15€, nuevo cliente",https://www.tucapital.es/cuentas/plan-amigo-bbva-cuenta-sin-comisiones-hasta-10-octubre-35e-padrino-15e-nuevo-cliente/,10/08/2022
Cuenta Facto sube también la rentabilidad de sus depósitos a corto y medio plazo,https://www.tucapital.es/depositos/cuenta-facto-sube-tambien-la-rentabilidad-de-sus-depositos-a-corto-plazo/,09/08/2022
Wizink pide desde hoy gastar 450€ con su tarjeta para que te de los 100€ en cheque Amazon,https://www.tucapital.es/blogs/noticias/wizink-pide-desde-hoy-gastar-450e-con-su-tarjeta-para-que-te-de-los-100e-en-cheque-amazon/,08/08/2022
"EBN mantiene la rentabilidad de hasta 0,7% TAE sus depósitos SÍ cancelables",https://www.tucapital.es/depositos/ebn-mantiene-en-el-07-tae-sus-depositos-si-cancelables/,08/08/2022
Wizink dará sólo hasta el 31 de Agosto 100€ en Amazon por contratar su tarjeta,https://www.tucapital.es/blogs/noticias/wizink-dara-solo-hasta-el-31-de-agosto-100e-en-amazon-por-contratar-su-tarjeta/,05/08/2022
"EBN sube aún más sus depósitos SinyCon Plus, hasta el 1,5%  TAE; 1% TAE a 1 año",https://www.tucapital.es/depositos/ebn-sube-aun-mas-sus-depositos-sinycon-plus-hasta-el-15-tae-1-a-1-ano/,04/08/2022
"Wizink sigue sin reaccionar, de los más rentables a uno cualquiera",https://www.tucapital.es/depositos/wizink-sigue-sin-reaccionar-de-los-mas-rentables-a-uno-cualquiera/,03/08/2022
Las cuentas de ahorro más rentables de agosto 2022: muchos cambios,https://www.tucapital.es/cuentas/las-cuentas-de-ahorro-mas-rentables-de-agosto-2022-muchos-cambios/,02/08/2022
Sabadell mejora aún más la oferta de su cuenta Online: 50€ + 1% TAE,https://www.tucapital.es/cuentas/sabadell-mejora-aun-mas-su-oferta-de-cuenta-online-50e-1-tae/,01/08/2022
Plan amigo (50€) y campaña nómina (300€) en Abanca hasta el 31/12,https://www.tucapital.es/cuentas/plan-amigo-50e-y-campana-nomina-300e-en-abanca-hasta-el-31-12/,28/07/2022
"Cuenta Online de Sabadell al 1% TAE, sólo hasta el próximo domingo",https://www.tucapital.es/cuentas/cuenta-online-de-sabadell-al-1-tae-solo-hasta-el-proximo-domingo/,27/07/2022
3 opciones de inversión con criptomonedas que debes conocer para los próximos meses,https://www.tucapital.es/blogs/guias/3-opciones-de-inversion-con-criptomonedas-que-debes-conocer-para-los-proximos-meses/,27/07/2022
¿Quieres 100€ en Amazon? Sólo tienes que contratar la tarjeta Wizink y usuarla,https://www.tucapital.es/blogs/noticias/quieres-100e-en-amazon-solo-tienes-que-contratar-la-tarjeta-wizink-y-usuarla/,26/07/2022
La banca extranjera supera la barrera del 2% TAE por tu dinero,https://www.tucapital.es/blogs/noticias/la-banca-extranjera-supera-la-barrera-del-2-tae-por-tu-dinero/,25/07/2022
"BCE sube el tipo de interés hasta el 0,5%. Hipotecas y depósitos subiendo…",https://www.tucapital.es/blogs/noticias/bce-sube-el-tipo-de-interes-hasta-el-05-hipotecas-y-depositos-subiendo/,22/07/2022
"Comparativa actualizada cuentas: ¿Banco Sabadell, Orange Bank, MyInvestor o Renault Bank?",https://www.tucapital.es/cuentas/comparativa-actualizada-cuentas-mas-rentables-banco-sabadell-orange-bank-myinvestor-o-renault-bank/,21/07/2022
MyInvestor sube hasta 20.000€ la remuneración al 1% TAE y ¿para siempre?,https://www.tucapital.es/cuentas/myinvestor-sube-hasta-20-000e-la-remuneracion-al-1-tae-y-para-siempre/,20/07/2022
"Comparativa cuentas sin comisiones y sin condiciones: BBVA, Santander, Sabadell e ING",https://www.tucapital.es/blogs/noticias/comparativa-cuentas-online-sin-comisiones-y-sin-condiciones-bbva-santander-sabadell-e-ing/,19/07/2022
Renault Bank sube la rentabilidad de su Cuenta para ganar a Orange Bank,https://www.tucapital.es/cuentas/renault-bank-sube-la-rentabilidad-de-su-cuenta-para-ganar-a-orange-bank/,18/07/2022
La Cuenta Nómina de ING comienza a cobrar 3€ de comisiones al mes,https://www.tucapital.es/cuentas/la-cuenta-nomina-de-ing-comienza-a-cobrar-comisiones-de-3e-al-mes/,14/07/2022
ING lanza la Cuenta NoCuenta: con muchas sombras y un sin fin de *,https://www.tucapital.es/cuentas/ing-lanza-la-cuenta-nocuenta-con-muchas-sombras-y-un-sin-fin-de/,14/07/2022
Santander sigue dando 100€ por nómina hasta el 30 de septiembre de 2022,https://www.tucapital.es/cuentas/santander-sigue-dando-100e-por-nomina-hasta-el-30-de-septiembre-de-2022/,13/07/2022
"Cuentas más rentables julio 2022: ¿Banco Sabadell, Orange Bank, MyInvestor o Renault Bank?",https://www.tucapital.es/cuentas/cuentas-mas-rentables-julio-2022-banco-sabadell-orange-bank-myinvestor-o-renault-bank/,12/07/2022
"Sabadell ofrece su cuenta online al 1% TAE, mejor de Orange Bank o MyInvestor",https://www.tucapital.es/cuentas/sabadell-ofrece-su-cuenta-online-al-1-tae-mejor-de-orange-bank-o-myinvestor/,11/07/2022
Openbank lanza una campaña de captación de nómina: ofrece 40€ netos.,https://www.tucapital.es/cuentas/openbank-lanza-una-campana-de-captacion-de-nomina-ofrece-40e-netos/,08/07/2022
Sólo hasta este domingo en Banco Sabadell: 100€ por abrir cuenta y usar tarjeta 1 vez,https://www.tucapital.es/cuentas/solo-hasta-este-domingo-en-banco-sabadell-100e-por-abrir-cuenta-y-usar-tarjeta-1-vez/,07/07/2022
Cómo los juegos en línea pueden ayudar a hacer nuevos amigos,https://www.tucapital.es/blogs/guias/como-los-juegos-en-linea-pueden-ayudar-a-hacer-nuevos-amigos/,07/07/2022
"…Y relanza el deposito SinyCon Plus, no cancelable, hasta el 1,15% TAE",https://www.tucapital.es/depositos/y-relanza-el-deposito-sinycon-plus-no-cancelable-hasta-el-115-tae/,06/07/2022
"EBN Banco convierte todos sus depósitos en SÍ cancelables: hasta 0,7% TAE",https://www.tucapital.es/depositos/ebn-banco-convierte-todos-sus-depositos-en-si-cancelables-hasta-07-tae/,05/07/2022
"Renault Bank sube la apuesta, y ofrece ahora su depósito al 1,4% TAE",https://www.tucapital.es/depositos/renault-bank-sube-la-apuesta-su-deposito-hasta-el-14-tae/,04/07/2022
"Orange Bank ofrece su 0,5% TAE hasta 100.000€ a partir de mañana, día 1 de julio",https://www.tucapital.es/cuentas/orange-bank-ofrece-su-05-tae-hasta-100-000e-a-partir-del-dia-1-de-julio/,30/06/2022
Wizink sigue dando 100€ en cheque Amazon,https://www.tucapital.es/blogs/noticias/wizink-sigue-dando-100e-en-cheque-amazon/,28/06/2022
"La banca extranjera ofrece ya un 1,84% TAE por tu dinero en España",https://www.tucapital.es/depositos/la-banca-extranjera-ofrece-ya-un-184-tae-por-tu-dinero-en-espana/,24/06/2022
EBN modifica a PEOR sus depósitos SÍ cancelables por los clientes. Ya eran malos,https://www.tucapital.es/cuentas/ebn-modifica-a-peor-sus-2-depositos-si-cancelables-por-los-clientes-ya-eran-malos/,24/06/2022
Sabadell ofrece 100€ por abrir una cuenta sin comisiones y usar 1 vez la tarjeta,https://www.tucapital.es/cuentas/sabadell-ofrece-100e-por-abrir-una-cuenta-sin-comisiones-y-usar-1-vez-la-tarjeta/,23/06/2022
"Banco Big sigue dando el 1% a 3 meses, algo desfasado",https://www.tucapital.es/depositos/banco-big-sigue-dando-el-1-a-3-meses-algo-desfasado/,21/06/2022
El fin anunciado de Twyp de ING desde que integró Bizum. ¿Y el cashbank?,https://www.tucapital.es/blogs/noticias/el-fin-anunciado-de-twyp-de-ing-desde-que-integro-bizum-y-el-cashbank/,20/06/2022
"Sólo hasta el 28/6 en Renault Bank: depósito al 1,1% TAE y cuenta al 0,45% TAE",https://www.tucapital.es/depositos/solo-hasta-el-28-6-en-renault-bank-deposito-al-11-tae-y-cuenta-al-045-tae/,17/06/2022
Bankinter amplia hasta diciembre de 2022 el 5% TAE de su cuentas Nómina,https://www.tucapital.es/cuentas/bankinter-amplia-hasta-diciembre-de-2022-el-5-tae-de-su-cuenta-nomina-pension-y-no-nomina/,16/06/2022
ING amplió su Plan Amigo ING hasta el 30 de junio: 40€ de bonificación a cada uno,https://www.tucapital.es/cuentas/ing-amplio-su-plan-amigo-ing-hasta-el-30-de-junio-40e-de-bonificacion-a-cada-uno/,15/06/2022
-14/06/2022:,,14/06/2022
Se acabó el dinero gratis. BCE subirá tipos. ¿Cómo afectará a los depósitos?,https://www.tucapital.es/blogs/noticias/se-acabo-el-dinero-gratis-bce-subira-tipos-como-afectara-a-los-depositos/,10/06/2022
"Pibank mantiene sin cambio la rentabilidad de su depósito en junio: 0,5% TAE",https://www.tucapital.es/depositos/pibank-mantiene-sin-cambio-la-rentabilidad-de-su-deposito-en-junio-05-tae/,09/06/2022
La tarjeta de Wizink ahora te da 100€ en cheque Amazon,https://www.tucapital.es/blogs/noticias/la-tarjeta-de-wizink-ahora-te-da-100e-en-cheque-amazon/,07/06/2022
"EBN lanza 2 depósitos SÍ cancelables por los clientes, pero corto plazo y bajo interés",https://www.tucapital.es/blogs/noticias/ebn-lanza-2-depositos-si-cancelables-por-los-clientes-pero-corto-plazo-y-bajo-interes/,07/06/2022
"Cuenta Facto está de vuelta, ofrece depósitos de hasta ¡¡1,4% TAE!!",https://www.tucapital.es/depositos/cuenta-facto-esta-de-vuelta-ofrece-depositos-de-hasta-14-tae/,06/06/2022
"Mercado depósitos se mueve: BFS también sube sus depósitos hasta el 0,9% TAE",https://www.tucapital.es/depositos/mercado-depositos-se-mueve-bfs-tambien-sube-sus-depositos-hasta-el-09-tae/,02/06/2022
"Deutsche Bank sigue ofreciendo depósito de hasta 0,6% TAE en Junio 2022",https://www.tucapital.es/depositos/deutsche-bank-sigue-ofreciendo-deposito-de-hasta-06-tae-en-junio-2022/,01/06/2022
"Hoy, último día del Plan Amigo ING: 40€ de bonificación a cada uno",https://www.tucapital.es/cuentas/hoy-ultimo-dia-del-plan-amigo-ing-40e-de-bonificacion-a-cada-uno/,31/05/2022
"Wizink mantiene sus depósitos de hasta 0,35% TAE, pero ya no es de los más rentables",https://www.tucapital.es/depositos/wizink-mantiene-sus-depositos-de-hasta-035-tae-pero-ya-no-es-de-los-mas-rentables/,30/05/2022
"RenaultBank sube hasta el 1,1% TAE su depósito Tú+ y la cuenta al 0,45%",https://www.tucapital.es/cuentas/renaultbank-sube-hasta-el-11-tae-su-deposito-tu-y-la-cuenta-al-045/,27/05/2022
Sabadell exigiendo más a sus clientes y Abanca se gasta 350€ para captarlos,https://www.tucapital.es/cuentas/sabadell-exigiendo-mas-a-sus-clientes-y-abanca-se-gasta-350e-por-captarlos/,26/05/2022
"ING no te deja contratar sólo la Cuenta Naranja, imprescindible la Cuenta Nómina",https://www.tucapital.es/cuentas/ing-no-te-deja-contratar-solo-la-cuenta-naranja-imprescindible-la-cuenta-nomina/,25/05/2022
"Grupo Galilea dice que ofrece Cuenta al 1,2% TAE y Depósito al 1,75% TAE",https://www.tucapital.es/blogs/noticias/grupo-galilea-dice-que-ofrece-cuenta-al-12-tae-y-deposito-al-175-tae/,24/05/2022
Deutsche Bank comunica a sus clientes las nuevas comisiones de transferencia SEPA,https://www.tucapital.es/cuentas/deutsche-bank-comunica-sus-nuevas-comisiones-de-transferencia-sepa/,23/05/2022
Openbank vuelve a bonificar con 40€ la contratación de su Cuenta Open sin comisiones,https://www.tucapital.es/cuentas/openbank-vuelve-a-bonificar-con-40e-la-contratacion-de-su-cuenta-open-sin-comisiones/,19/05/2022
Comparativa fracasadas comisiones de la Cuenta 123 vs nuevas de Sabadell,https://www.tucapital.es/cuentas/comparativa-fracasadas-comisiones-de-la-cuenta-123-vs-nuevas-de-sabadell/,18/05/2022
BBVA ofrece gratis a nuevos clientes 6 meses de Netflix o HBO o DAZN o Disney + …,https://www.tucapital.es/cuentas/bbva-ofrece-gratis-a-nuevos-clientes-6-meses-de-netflix-hbo-dazn-disney/,17/05/2022
"Deutsche Bank: alta morosidad y caída en el capital, ¿motivos de sus nuevos depósitos?",https://www.tucapital.es/depositos/deutsche-bank-alta-morosidad-y-caida-en-el-capital-motivos-de-sus-nuevos-depositos/,16/05/2022
"Renault Bank sube la rentabilidad su Depósito Tú+ hasta el 0,7% TAE",https://www.tucapital.es/depositos/renault-bank-sube-la-rentabilidad-su-deposito-tu-hasta-el-07-tae/,12/05/2022
"Deutsche Bank lanza depósitos de hasta 0,6% TAE después de años",https://www.tucapital.es/cuentas/deutsche-bank-lanza-depositos-de-hasta-06-tae-despues-de-anos/,11/05/2022
"EBN sube la rentabilidad de sus depósitos, ahora hasta el 0,7% TAE",https://www.tucapital.es/depositos/ebn-sube-la-rentabilidad-de-sus-depositos-ahora-hasta-el-07-tae/,11/05/2022
¿Tienes la Cuenta Expansión? Aquí tienes 12 alternativas sin comisiones y sin condiciones,https://www.tucapital.es/cuentas/tienes-la-cuenta-expansion-aqui-tienes-12-alternativas-sin-comisiones-y-sin-condiciones/,10/05/2022
Nuevas comisiones: Clientes de Cuenta Expansión pagarán 20€ trimestrales a partir de junio,https://www.tucapital.es/cuentas/nuevas-comisiones-clientes-de-cuenta-expansion-banco-sabadell-pagaran-20e-trimestrales-a-partir-de-junio/,09/05/2022
Vuelve el Plan Amigo ING: 40€ por abrir cuenta con la ayuda de un cliente,https://www.tucapital.es/cuentas/vuelve-el-plan-amigo-ing-40e-por-abrir-cuenta-con-la-ayuda-de-un-cliente/,05/05/2022
Openbank sigue ofreciendo una cuenta al 5% TAE si domicilias una nómina,https://www.tucapital.es/cuentas/openbank-sigue-ofreciendo-una-cuenta-al-5-tae-si-domicilias-una-nomina/,04/05/2022
"Top bancos con más fans según EMO Insights, y ¡el número 1 no es ING!",https://www.tucapital.es/blogs/noticias/top-bancos-con-mas-fans-segun-emo-insights-y-el-numero-1-no-es-ing/,03/05/2022
"Plan Amigo Abanca: 50€ para ti, y 300€ para el amigo que lleve nómina",https://www.tucapital.es/cuentas/plan-amigo-abanca-50e-para-ti-y-300e-para-el-amigo-que-lleve-nomina/,28/04/2022
¿Aficionado al PlayStation? 3 meses PS Plus gratis o 25€ en PSN y con nómina 150€,https://www.tucapital.es/blogs/noticias/aficionado-al-playstation-3-meses-ps-plus-gratis-o-25e-en-psn-y-con-nomina-150e/,27/04/2022
"Banco Progetto ofrece un 1,25% TAE a 3 años, el más rentable del mercado",https://www.tucapital.es/depositos/banco-progente-ofrece-un-125-tae-a-3-anos-el-mas-rentable-del-mercado/,26/04/2022
"EBN sigue ofreciendo sus depósitos de hasta 0,6% TAE a todos",https://www.tucapital.es/cuentas/ebn-sigue-ofreciendo-sus-depositos-de-hasta-06-tae-a-todos/,25/04/2022
Cómo se diferencia Bitcoin del dinero móvil,https://www.tucapital.es/blogs/guias/como-se-diferencia-bitcoin-del-dinero-movil/,25/04/2022
"Depósitos de BFS hasta 0,65% TAE también en Abril de 2022",https://www.tucapital.es/depositos/depositos-de-bfs-hasta-065-tae-tambien-en-abril-de-2022/,21/04/2022
"Orange Bank sigue exigiendo ser cliente de Orange para darte el 0,5% TAE",https://www.tucapital.es/cuentas/orange-bank-sigue-exigiendo-ser-cliente-de-orange-para-darte-el-05-tae/,20/04/2022
"Banco Pichincha, al igual que Pibank, también sube su depósito al 0,5% TAE",https://www.tucapital.es/depositos/banco-pichincha-al-igual-que-pibank-tambien-sube-su-deposito-al-05-tae/,19/04/2022
"Cuenta Junior MyInvestor, la cuenta más rentable para menores, al 1% TAE",https://www.tucapital.es/cuentas/cuenta-junior-myinvestor-la-cuenta-mas-rentable-para-menores-al-1-tae/,18/04/2022
"EBN te sube hasta 0,2% la Cuenta si inviertes en sus productos de inversión",https://www.tucapital.es/cuentas/ebn-te-sube-hasta-02-la-cuenta-si-inviertes-en-sus-productos-de-inversion/,11/04/2022
"Pibank duplica la rentabilidad de su depósito a 1 año, ahora al 0,5% TAE",https://www.tucapital.es/depositos/pibank-duplica-la-rentabilidad-de-su-deposito-a-1-ano-ahora-al-05-tae/,08/04/2022
¿La Guerra de Urania es el principio del fin del dinero gratis? ¿Subirán los depósitos?,https://www.tucapital.es/blogs/noticias/la-guerra-de-urania-es-el-principio-del-fin-del-dinero-gratis-subiran-los-depositos/,07/04/2022
Casi 3 años sin transferencias inmediatas en Evo Banco por «ajustes técnicos»,https://www.tucapital.es/blogs/noticias/casi-3-anos-sin-transferencias-inmediatas-en-evo-banco-por-ajustes-tecnicos/,06/04/2022
Evo Banco añade los cajeros de ING donde retirar efectivo gratis,https://www.tucapital.es/blogs/noticias/evo-banco-anade-los-cajeros-de-ing-donde-retirar-efectivo-gratis/,05/04/2022
Santander sigue dando 100€ por nómina hasta el 30 de junio de 2022,https://www.tucapital.es/cuentas/santander-sigue-dando-100e-por-nomina-hasta-el-30-de-junio-de-2022/,04/04/2022
Abanca amplia su oferta de 300€ a cambio de nómina para todos hasta diciembre,https://www.tucapital.es/cuentas/abanca-amplia-su-oferta-de-300e-a-cambio-de-nomina-para-todos-hasta-diciembre/,01/04/2022
BCE: «Desproporcionado» el límite de 1.000 euros en los pagos en efectivo en España,https://www.tucapital.es/blogs/noticias/bce-desproporcionado-el-limite-de-1-000-euros-en-los-pagos-en-efectivo-en-espana/,31/03/2022
"BFS sigue dando hasta 0,65% TAE en sus depósito, de los más rentables",https://www.tucapital.es/depositos/bfs-sigue-dando-hasta-065-tae-en-sus-deposito-de-los-mas-rentables/,30/03/2022
¿ «Tenemos un motivo para hacerte sonreír» ? por la nueva Web de ING,https://www.tucapital.es/cuentas/ing-tenemos-un-motivo-para-hacerte-sonreir-por-su-nueva-web/,29/03/2022
Conozca algunas cosas que debe tener en cuenta al elegir una billetera Bitcoin,https://www.tucapital.es/blogs/guias/conozca-algunas-cosas-que-debe-tener-en-cuenta-al-elegir-una-billetera-bitcoin/,28/03/2022
Billetera Bitcoin: aspectos esenciales para asegurar su billetera digital,https://www.tucapital.es/blogs/guias/billetera-bitcoin-aspectos-esenciales-para-asegurar-su-billetera-digital/,28/03/2022
¿Dinero en bancos extranjeros? Menos de 1 semana para presentar modelo 720,https://www.tucapital.es/blogs/noticias/dinero-en-bancos-extranjeros-menos-de-1-semana-para-presentar-modelo-720/,25/03/2022
"Los nuevos depósitos de EBN de hasta 0,6% TAE, No cancelable por tí, sí por el banco",https://www.tucapital.es/cuentas/los-nuevos-depositos-de-ebn-de-hasta-06-tae-no-cancelable-por-ti-si-por-el-banco/,24/03/2022
"Ahora, Abanca da 300€ a cambio de nómina en toda España",https://www.tucapital.es/cuentas/ahora-abanca-da-300e-a-cambio-de-nomina-en-toda-espana/,21/03/2022
Cuentas que ofrecen dinero por tu nómina. Cuidado algunos terminan en marzo,https://www.tucapital.es/cuentas/cuentas-que-ofrecen-dinero-por-tu-nomina-cuidado-algunos-terminan-en-marzo/,17/03/2022
