title,url,date
"Banco Big ofrece depósitos del 3% TAE a 6 y 12 meses y 2,25% TAE a 3 meses",https://www.tucapital.es/depositos/banco-big-ofrece-depositos-del-3-tae-a-6-y-12-meses-y-225-tae-a-3-meses/,18/08/2023
"MyInvestor: 2,75% TAE a 3 meses y 3,00% TAE a 6 y 12 meses hasta el 31 de agosto",https://www.tucapital.es/depositos/myinvestor-275-tae-a-3-meses-y-300-tae-a-6-y-12-meses-hasta-el-31-de-agosto/,17/08/2023
"ING sube la rentabilidad de sus depósitos Naranja hasta el 1,75% TAE",https://www.tucapital.es/depositos/ing-sube-la-rentabilidad-de-sus-deposito-naranja-hasta-el-175-tae/,16/08/2023
¿Renault Bank discrimina clientes Españoles frente a los Alemanes?,https://www.tucapital.es/depositos/renault-bank-discrimina-clientes-espanoles-frente-a-los-alemanes/,14/08/2023
Siguen los depósitos con extra tipos de EBN para clientes y no clientes hasta 31 de agosto,https://www.tucapital.es/depositos/ebn-sigue-ofreciendo-los-depositos-con-tipos-extras-para-clientes-hasta-31-de-agosto/,10/08/2023
"Plan amigo de TargoBank hasta septiembre: 30€ para cada uno,  y cuenta al 2,53% TAE",https://www.tucapital.es/cuentas/plan-amigo-de-targobank-hasta-septiembre-30e-para-cada-uno-y-cuenta-al-253-tae/,09/08/2023
"Haitong sube la rentabilidad de sus depósitos a 6 y 9 meses de plazo hasta 3,81% TAE",https://www.tucapital.es/depositos/haitong-sube-la-rentabilidad-de-sus-depositos-a-6-y-9-meses-de-plazo-hasta-381-tae/,08/08/2023
"46.345 millones de euros en depósitos y cuentas de ING, y creciendo… Increíble",https://www.tucapital.es/cuentas/46-345-millones-de-euros-en-ing-y-creciendo-increible/,07/08/2023
Casinos de Neteller: ¿Por qué es importante que los casinos en línea ofrezcan pagos rápidos?,https://www.tucapital.es/blogs/guias/casinos-de-neteller-por-que-es-importante-que-los-casinos-en-linea-ofrezcan-pagos-rapidos/,07/08/2023
Más detalle sobre la Cuenta Flexible de Revolut: no es cuenta es un Fondo Monetario,https://www.tucapital.es/cuentas/mas-detalle-sobre-la-cuenta-flaxible-de-revolut-no-es-cuenta-es-un-fondo-monetario/,03/08/2023
Cómo reducir los riesgos al apostar en línea y no perder tus ganancias,https://www.tucapital.es/blogs/guias/como-reducir-los-riesgos-al-apostar-en-linea-y-no-perder-tus-ganancias/,02/08/2023
"Revolut ofrece una cuenta al 3,4% TAE. ¿Es una Cuenta? ¿Con FGD? ¿…?",https://www.tucapital.es/cuentas/cuenta-revolut-al-334-tae-es-una-cuenta-con-fgd-todo-lo-que-debes-de-saber/,01/08/2023
"Banca March sube hasta el 3,3% TAE su depósito a 12 meses",https://www.tucapital.es/depositos/banca-march-sube-hasta-el-33-tae-su-deposito-a-12-meses/,01/08/2023
"Banco Caminos ofrece un depósito a 12 meses al 3,29% TAE",https://www.tucapital.es/depositos/banco-caminos-ofrece-un-deposito-a-12-meses-al-329-tae/,31/07/2023
EBN ofrece ahora los mismos depósitos a 9 y 12 meses con extra tipos a nuevos clientes,https://www.tucapital.es/depositos/ebn-ofrece-ahora-los-mismos-depositos-a-9-y-12-meses-con-extra-tipos-a-nuevos-clientes/,27/07/2023
"Sin novedades en Renault Bank: 2,63% TAE cuenta y 3,65% TAE depósito hasta septiembre",https://www.tucapital.es/blogs/noticias/sin-novedades-en-renault-bank-263-tae-cuenta-y-365-tae-deposito-hasta-septiembre/,27/07/2023
-26/07/2023:,https://www.tucapital.es/blogs/noticias/sin-novedades-en-renault-bank-263-tae-cuenta-y-365-tae-deposito-hasta-septiembre/,26/07/2023
"Orange Bank subirá, en septiembre, hasta el 2% TAE su cuenta de ahorro",https://www.tucapital.es/cuentas/orange-bank-subira-en-septiembre-hasta-el-2-tae-su-cuenta-de-ahorro/,25/07/2023
"Openbank ofrece un depósito al 2,01% TAE o al 3,07% TAE si domicilias tus ingresos",https://www.tucapital.es/depositos/openbank-ofrece-un-deposito-al-201-tae-o-al-307-tae-si-domicilias-tus-ingresos/,24/07/2023
Abanca sigue hasta el 31 de diciembre con su cuenta al 2% + 300€ netos si llevas la nómina,https://www.tucapital.es/depositos/abanca-sigue-hasta-el-31-de-diciembre-con-su-cuenta-al-2-300e-netos-si-llevas-la-nomina/,20/07/2023
Las principales tecnologías que han alterado el sector de los casinos en línea,https://www.tucapital.es/blogs/guias/las-principales-tecnologias-que-han-alterado-el-sector-de-los-casinos-en-linea/,20/07/2023
"Self Bank ofrece ahora un depósito a 3 meses y al 3% TAE, el más rentable a ese plazo",https://www.tucapital.es/cuentas/self-bank-ofrece-ahora-un-deposito-a-3-meses-y-al-3-tae-el-mas-rentable-del-mercado/,19/07/2023
BBVA te da 210€ por domiciliar sólo 1 recibo durante 6 meses en su Cuenta Online,https://www.tucapital.es/cuentas/bbva-te-da-210e-por-domiciliar-solo-1-recibo-durante-6-meses-en-su-cuenta-online/,18/07/2023
"ING amplia hasta el 31 de julio su depósito a 3 meses y al 2,5% TAE para dinero nuevo",https://www.tucapital.es/depositos/ing-amplia-hasta-el-31-de-julio-su-deposito-a-3-meses-y-al-25-tae-para-dinero-nuevo/,17/07/2023
"Renault Bank sólo prorroga sus productos: 2,63% TAE cuenta y 3,65% TAE depósito",https://www.tucapital.es/depositos/renault-bank-solo-prorroga-sus-productos-263-tae-cuenta-y-332-tae-deposito/,13/07/2023
"EBN también se apunta a lo de amago: ofrece 2,9% TAE a 4 meses",https://www.tucapital.es/depositos/ebn-tambien-se-apunta-a-lo-de-amago-ofrece-29-tae-a-4-meses/,11/07/2023
"…Y si decides llevarte dinero de ING: te ofrece 2,5% TAE a 12 meses. Truco amago",https://www.tucapital.es/depositos/y-si-decides-llevarte-dinero-de-ing-te-ofrece-25-tae-truco-amago/,10/07/2023
"ING quiere cabrear al personal, 2,75% TAE para clientes seleccionados",https://www.tucapital.es/depositos/ing-quiere-cabrear-al-personal-275-tae-para-clientes-seleccionados/,06/07/2023
Haitong ofrece ahora un 4%  TAE o más a partir de 12 meses de plazo,https://www.tucapital.es/depositos/haitong-ofrece-un-4-tae-o-mas-a-partir-de-12-meses-de-plazo/,06/07/2023
"Wizink BAJA la rentabilidad de sus depósitos, mientras el Euribor marca máximos….",https://www.tucapital.es/depositos/wizink-baja-la-rentabilidad-de-sus-depositos-mientras-el-euribor-marca-maximos/,05/07/2023
Cómo la tecnología Bitcoin podría revolucionar las cadenas de suministro,https://www.tucapital.es/blogs/guias/como-la-tecnologia-bitcoin-podria-revolucionar-las-cadenas-de-suministro/,05/07/2023
Orange Bank a la venta. ¿Qué pasará con sus 200.000 clientes?,https://www.tucapital.es/cuentas/adios-orange-bank-a-la-venta-que-pasara-con-sus-200-000-clientes/,05/07/2023
"EBN ofrece rentabilidad extra a los clientes en sus depósitos. La cuenta al 1,25% TAE",https://www.tucapital.es/depositos/ebn-ofrece-rentabilidad-extra-a-los-clientes-en-sus-depositos-la-cuenta-al-125-tae/,03/07/2023
"Cuenta Online al 2,5% TAE del Sabadell hasta septiembre, ahora 3% por tus compras",https://www.tucapital.es/cuentas/cuenta-online-al-25-tae-del-sabadell-hasta-septiembre-ahora-3-por-tus-compras/,03/07/2023
"Unicaja ofrece un 2% TAE por tu nómina, y sin nómina da el 1% TAE a nuevos clientes",https://www.tucapital.es/cuentas/unicaja-ofrece-un-2-tae-por-tu-nomina-y-sin-nomina-da-el-1-tae-a-nuevos-clientes/,29/06/2023
-27/06/2023:,,27/06/2023
"Banca March ahora a al 2,6% TAE su depósito a 12 meses cancelable",https://www.tucapital.es/depositos/banca-march-ahora-a-al-26-tae-su-deposito-a-12-meses-cancelable/,26/06/2023
Como siempre Renault Bank sube también la cuenta remunerada para los clientes,https://www.tucapital.es/depositos/como-siempre-renault-bank-sube-tambien-la-cuenta-remunerada-para-los-clientes/,23/06/2023
"Cuenta Contigo de Renault Bank, ahora es la cuenta más rentable: 2,63% TAE",https://www.tucapital.es/cuentas/cuenta-contigo-de-renault-bank-ahora-es-la-cuenta-mas-rentable-263-tae/,22/06/2023
"Myinvestor lanzará un depósito al 2,75% TAE y a sólo 3 meses de plazo",https://www.tucapital.es/depositos/myinvestor-lanzara-un-deposito-al-275-tae-solo-a-3-meses-de-plazo/,21/06/2023
"Facto: Nueva web, nuevo dominio y todo centrado en la captación de depósitos",https://www.tucapital.es/depositos/facto-nueva-web-nuevo-dominio-y-todo-centrado-en-la-captacion-de-depositos/,20/06/2023
Cualidades que hacen que Bitcoin sea considerado dinero,https://www.tucapital.es/blogs/guias/cualidades-que-hacen-que-bitcoin-sea-considerado-dinero/,20/06/2023
Por qué el mercado de Bitcoin está a punto de estallar,https://www.tucapital.es/blogs/guias/por-que-el-mercado-de-bitcoin-esta-a-punto-de-estallar/,20/06/2023
"Haitong, sucursal España, sube ligeramente el depósito a 12 meses",https://www.tucapital.es/depositos/haitong-sucursal-espana-sube-ligeramente-el-deposito-a-12-meses/,19/06/2023
"Openbank sube la cuenta Ahorro Bienvenida hasta el 1,75% TAE",https://www.tucapital.es/cuentas/openbank-sube-la-cuenta-ahorro-bienvenida-hasta-el-175-tae/,16/06/2023
"ING relanza su depósito a 3 meses de plazo pero al 2,5% TAE para dinero nuevo",https://www.tucapital.es/depositos/ing-saca-un-deposito-al-25-tae-para-dinero-nuevo/,15/06/2023
Deutsche Bank trata captar grandes nómina con 360€ en efectivo y 2% TAE en la cuenta,https://www.tucapital.es/cuentas/deutsche-bank-trata-captar-grandes-nomina-con-360e-y-2-tae/,14/06/2023
-13/06/2023:,https://www.tucapital.es/cuentas/deutsche-bank-trata-captar-grandes-nomina-con-360e-y-2-tae/,13/06/2023
"Cuenta ahorro de N26 al 2,26% TAE, buena alternativa pero, de monento, NO disponible para todos",https://www.tucapital.es/cuentas/cuenta-ahorro-de-n26-al-226-tae-una-buena-alternativa-aunque-no-para-todos/,12/06/2023
"Bank Norwegian sube su Cuenta de Ahorro hasta el 2,50% TAE",https://www.tucapital.es/cuentas/bank-norwegian-sube-su-cuenta-de-ahorro-hasta-el-250-tae/,09/06/2023
Ranking de los depósitos más rentables de junio de 2023,https://www.tucapital.es/depositos/ranking-de-los-depositos-mas-rentables-de-junio-de-2023/,09/06/2023
"Renault Bank sube por fin la rentabilidad de su depósito, hasta 3,65% TAE",https://www.tucapital.es/depositos/renault-bank-sube-por-fin-la-rentabilidad-de-su-deposito-hasta-365-tae/,08/06/2023
"Haitong Bank: Información, rating y productos",https://www.tucapital.es/bancos/haitong-bank/,07/06/2023
"Evo Banco sube hasta el 2,5% TAE su Cuenta Inteligente sólo para nuevos clientes",https://www.tucapital.es/depositos/evo-banco-sube-hasta-el-25-tae-su-cuenta-inteligente-solo-para-nuevos-clientes/,07/06/2023
"Haitong, sucursal España, roza el 4% TAE en sus depósitos",https://www.tucapital.es/depositos/haitong-sucursal-espana-roza-el-4-tae-en-sus-depositos/,06/06/2023
"Subión de la Cuenta Próxima de TargoBank: ahora al 2,53% TAE, el más rentable del mercado",https://www.tucapital.es/cuentas/subion-de-la-cuenta-proxima-de-targobank-ahora-al-253-tae-el-mas-rentable-del-mercado/,05/06/2023
"BFS sube sus depósitos hasta el 3,75% TAE y son los más rentables del mercado",https://www.tucapital.es/depositos/bfs-sube-sus-depositos-hasta-el-375-tae-y-son-los-mas-rentables-del-mercado/,02/06/2023
"ING también sube la rentabilidad de sus depósitos, hasta 1,5% TAE",https://www.tucapital.es/depositos/ing-tambien-sube-la-rentabilidad-de-sus-depositos-hasta/,01/06/2023
"Wizink elimina el depósito a 3 meses y al 3% TAE, y prorroga el resto de hasta 3,3% TAE",https://www.tucapital.es/depositos/wizink-elimina-el-deposito-al-3-tae-a-3-meses-y-prorroga-el-resto/,01/06/2023
"Sabadell prorroga por 2 meses su cuenta online al 2,5% TAE y 200€ por nómina",https://www.tucapital.es/cuentas/sabadell-prorroga-por-2-meses-su-cuenta-online-al-25-tae-y-200e-por-nomina/,01/06/2023
Banco BIG deja en la estacada a miles de ahorradores. Quita su depósito al 4% TAE,https://www.tucapital.es/blogs/noticias/banco-big-deja-en-la-estacada-a-miles-de-ahorradores-quiza-su-deposito-al-4-tae/,31/05/2023
"Novedades previstas para mañana, 1 de junio de 2023. Nuevos tipos, renovación de ofertas…",https://www.tucapital.es/depositos/novedades-previstas-para-manana-1-de-junio-de-2023-nuevos-tipos-renovacion-de-ofertas/,31/05/2023
"Self Bank lanza 2 depósitos interesantes: 2% TAE a 1 año y 2,75% TAE a 2 años",https://www.tucapital.es/depositos/self-bank-lanza-2-depositos-2-tae-a-1-ano-y-275-tae-a-2-anos/,30/05/2023
"N26: Información, rating y productos",https://www.tucapital.es/bancos/n26/,30/05/2023
MyInvestor te da un 3% TAE a 6 meses sin historias como Openbank,https://www.tucapital.es/depositos/myinvestor-te-da-un-3-tae-a-6-meses-sin-historias-como-openbank/,30/05/2023
"Contra-oferta de Openbank: 3% TAE a 6 meses y 3,2% TAE a 12 meses de plazo",https://www.tucapital.es/depositos/contra-oferta-de-openbank-3-tae-a-6-meses-y-32-tae-a-12-meses-de-plazo/,29/05/2023
"EBN sigue con su cheque Amazon de 15€ para captar depósitos: hasta 3,2% TAE",https://www.tucapital.es/depositos/ebn-sigue-con-su-cheque-amazon-para-captar-depositos-hasta-32-tae/,26/05/2023
"ING subirá en junio la rentabilidad de la Cuenta Naranja, hasta el 1,25% TAE",https://www.tucapital.es/cuentas/ing-subira-en-junio-la-rentabilidad-de-la-cuenta-naranja-hasta-el-125-tae/,25/05/2023
¿Renault Bank se durmió? prorroga por 2 semana más sus productos de ahorro,https://www.tucapital.es/depositos/renault-bank-se-durmio-prorroga-por-2-semana-mas-sus-productos-de-ahorro/,25/05/2023
Más plazo para contratar el depósito al 4% TAE de Banco Big: hasta el 31 de mayo de 2023,https://www.tucapital.es/depositos/mas-plazo-para-contratar-el-deposito-al-4-tae-de-banco-big-hasta-el-31-de-mayo-de-2023/,24/05/2023
"Wizink y su proceso de contratación de depósito, ¿sigue siendo deficiente?",https://www.tucapital.es/depositos/wizink-y-su-proceso-de-contratacion-de-deposito-sigue-siendo-deficiente/,23/05/2023
MyInvestor ya anuncia sus nuevos depósitos al 3% TAE a 6 y 12 meses de plazo,https://www.tucapital.es/depositos/myinvestor-ya-anuncia-sus-nuevos-depositos-al-3-tae-a-6-y-12-meses-de-plazo/,22/05/2023
"…. y mientras ING anuncia esto: Un fondo con objetivo de rentabilidad del 2,4% TAE",https://www.tucapital.es/depositos/y-mientras-ing-anuncia-esto-un-fondo-con-objetivo-de-rentabilidad-del-24-tae/,19/05/2023
"Haitong, sucursal España, hasta 3,71%; otra opción a tener en cuenta",https://www.tucapital.es/depositos/haitong-sucursal-espana-hasta-371-otra-opcion-a-tener-en-cuenta/,18/05/2023
"MyInvestor lanzará en 1 semana 2 depósitos al 3% TAE, a 6 y 12 meses de plazo",https://www.tucapital.es/depositos/myinvestor-lanzara-en-1-semana-2-depositos-al-3-tae-a-6-y-12-meses-de-plazo/,17/05/2023
Renault Bank no reacciona ante los últimos cambios. Prorroga todo por 1 semana,https://www.tucapital.es/depositos/renault-bank-no-reacciona-ante-los-ultimos-cambios-prorroga-todo-por-1-semana/,17/05/2023
"N26 lanza una cuenta de Ahorro al 2,26% TAE para un máximo de 50.000€",https://www.tucapital.es/cuentas/n26-lanza-una-cuenta-de-ahorro-al-226-tae-para-un-maximo-de-50-000e/,16/05/2023
"Facto sube la rentabilidad de sus depósitos hasta 3,5% TAE desde 6 meses, 3% a 3 meses",https://www.tucapital.es/depositos/facto-sube-la-rentabilidad-de-sus-depositos-hasta-35-tae-desde-6-meses-3-a-3-meses/,16/05/2023
Banco BIG también ofrece ese 4% TAE a los ya clientes que lleven dinero,https://www.tucapital.es/depositos/banco-big-tambien-ofrece-ese-4-tae-a-los-ya-clientes-que-lleven-dinero/,16/05/2023
Aprende los números que más salen en la ruleta electrónica,https://www.tucapital.es/blogs/guias/aprende-los-numeros-que-mas-salen-en-la-ruleta-electronica/,15/05/2023
Hardware para minería de Bitcoin al alcance de todos,https://www.tucapital.es/blogs/guias/hardware-para-mineria-de-bitcoin-al-alcance-de-todos/,15/05/2023
"Bankinter mejora su cuenta Nómina, sigue al 5% TAE, pero para el doble de dinero",https://www.tucapital.es/cuentas/bankinter-mejora-su-cuenta-nomina-sigue-al-5-tae-pero-para-el-doble-de-dinero/,15/05/2023
Banco Mediolanum ofrece un depósito al 4% TAE para nuevos clientes y un pero,https://www.tucapital.es/depositos/banco-mediolanum-ofrece-un-deposito-al-4-tae-para-nuevos-clientes-y-un-pero/,12/05/2023
Guerra de depósitos: 10 bancos luchan por captar tu liquidez,https://www.tucapital.es/depositos/guerra-de-depositos-10-bancos-luchan-por-captar-tu-liquidez/,11/05/2023
La cuenta online de NN Bank temporalmente no disponible para su contratación,https://www.tucapital.es/cuentas/la-cuenta-online-de-nn-bank-temporalmente-no-disponible/,10/05/2023
TargoBank sube hasta 3% TAE sus depósitos cancelables,https://www.tucapital.es/depositos/targobank-sube-hasta-3-tae-sus-depositos-cancelables/,09/05/2023
"Banco Big al 4% TAE, el depósito más rentable del mercado",https://www.tucapital.es/depositos/banco-big-al-4-tae-el-deposito-mas-rentable-del-mercado/,09/05/2023
¿Facto pierde la hegemonía o sigue siendo vuestra opción a pesar de Wizink?,https://www.tucapital.es/depositos/facto-pierde-la-hegemonia-o-sigue-siendo-vuestra-opcion-a-pesar-de-wizink/,08/05/2023
"BFS sube la rentabilidad de todos sus depósitos, ofreciendo el 3,4% TAE como máximo",https://www.tucapital.es/depositos/bfs-sube-todos-sus-depositos-ofreciendo-el-34-tae-como-maximo/,05/05/2023
"Orange Bank subirá hasta el 1,8% TAE a partir de 1 de junio de 2023",https://www.tucapital.es/cuentas/orange-bank-subira-hasta-el-18-tae-a-partir-de-1-de-junio-de-2023/,04/05/2023
Lío en las ofertas de Wizink: cada web de Wizink dice una cosa diferente,https://www.tucapital.es/depositos/lio-en-las-ofertas-de-wizink-cada-web-de-wizink-dice-una-cosa-diferente/,04/05/2023
"EBN sube hasta 3,20% TAE sus depósitos y regala 15€ en cheque Amazon",https://www.tucapital.es/depositos/ebn-sube-hasta-320-tae-sus-depositos-y-regala-15e-en-cheque-amazon/,03/05/2023
Openbank ofrece un depósito al 3% TAE y a 6 meses de forma personalizada,https://www.tucapital.es/depositos/openbank-ofrece-un-deposito-al-3-tae-y-a-6-meses-de-forma-personalizada/,03/05/2023
Aclaraciones sobre la oferta que viene de Wizink a partir de mañana,https://www.tucapital.es/depositos/aclaraciones-sobre-la-oferta-que-viene-de-wizink-a-partir-de-manana/,03/05/2023
"2 días los depósitos a 3% TAE a 3 meses y 3,3% TAE a 12 meses de Wizink",https://www.tucapital.es/depositos/2-dias-para-el-lanzamiento-de-los-depositos-a-3-tae-a-3-meses-y-33-tae-a-12-meses-de-wizink/,02/05/2023
Préstamos online en el acto sin requsítos: cómo obtener financiamiento sin trabajo,https://www.tucapital.es/blogs/guias/prestamos-online-en-el-acto-sin-requsitos-como-obtener-financiamiento-sin-trabajo/,28/04/2023
"Evo Banco también ofrece un 2% TAE a clientes, vía depósito a 6 meses",https://www.tucapital.es/depositos/evo-banco-tambien-ofrece-un-2-tae-a-clientes-via-deposito-a-6-meses/,27/04/2023
"Renault Bank sube su cuenta de Ahorro hasta el 2,27% TAE; depósito al 3,34% TAE, sin cambios",https://www.tucapital.es/cuentas/renault-bank-sube-su-cuenta-de-ahorro-hasta-el-227-tae/,26/04/2023
Bitcoin cierra enero con un aumento del 40%,https://www.tucapital.es/blogs/guias/bitcoin-cierra-enero-con-un-aumento-del-40/,26/04/2023
Cuenta online clara de Abanca al 2% + 300€ netos si llevas la nómina,https://www.tucapital.es/cuentas/cuenta-online-clara-de-abanca-al-2-300e-netos-si-llevas-la-nomina/,25/04/2023
Bankinter ofrece una cuenta al 1% TAE sin condiciones y comisiones,https://www.tucapital.es/cuentas/bankinter-ofrece-una-cuenta-al-1-tae-sin-condiciones-y-comisiones/,24/04/2023
"Sabadell sube hasta 2,5% TAE su cuenta online sin comisiones y condiciones",https://www.tucapital.es/cuentas/sabadell-sube-hasta-25-tae-su-cuenta-online-sin-comisiones-y-condiciones/,21/04/2023
MyInvestor ofrece su cuenta al 2% TAE también a clientes que lleve dinero nuevo,https://www.tucapital.es/cuentas/myinvestor-ofrece-su-cuenta-al-2-tae-tambien-a-clientes-que-lleve-dinero-nuevo/,20/04/2023
"Wizink se superará en Mayo: 3% TAE a 3 meses y 3,3% TAE a 12 meses",https://www.tucapital.es/depositos/wizink-se-superara-en-mayo-3-tae-a-3-meses-y-33-tae-a-12-meses/,19/04/2023
"3 Cuentas de Ahorro al 2% TAE: Myinvestor, Sabadell y Evo Banco",https://www.tucapital.es/cuentas/3-cuentas-de-ahorro-al-2-tae-myinvestor-sabadell-y-evo-banco/,19/04/2023
"TargoBank sube hasta 2,6% TAE sus depósitos cancelables",https://www.tucapital.es/depositos/targobank-sube-hasta-26-tae-sus-depositos-cancelables/,18/04/2023
"Celetem también ofrece una cuenta al 2% TAE, sin límites y sin condiciones.",https://www.tucapital.es/cuentas/celetem-tambien-ofrece-una-cuenta-al-2-tae/,17/04/2023
Evo Banco subirá mañana hasta el 2% TAE su Cuenta Inteligente sólo para nuevos clientes,https://www.tucapital.es/cuentas/evo-banco-subira-hasta-el-2-tae-su-cuenta-inteligente-solo-para-nuevos-clientes/,13/04/2023
"Banco Big sube la rentabilidad de los depósitos de clientes hasta 1,85% TAE",https://www.tucapital.es/blogs/noticias/banco-big-sube-la-rentabilidad-de-los-depositos-contratables-por-clientes/,13/04/2023
"Renault Bank sube su depósito hasta 3,34% TAE, la cuenta sin cambios en 1,81% TAE",https://www.tucapital.es/depositos/renault-bank-sube-su-deposito-hasta-334-tae-la-cuenta-sin-cambios-en-181-tae/,12/04/2023
"Depósitos Raisin ya superan el 4% TAE, ¿merecen la pena? comparativa",https://www.tucapital.es/cuentas/depositos-raisin-ya-supera-el-4-tae-merece-la-pena-comparativa/,11/04/2023
"Ranking de las cuentas más rentables del mes de abril 2023, bastantes cambios",https://www.tucapital.es/cuentas/ranking-de-las-cuentas-mas-rentables-del-mes-de-abril-2023/,10/04/2023
"Por fin Wizink sube su cuenta de ahorro, ahora al 1% TAE",https://www.tucapital.es/cuentas/por-fin-wizink-sube-su-cuenta-de-ahorro-ahora-al-1-tae/,05/04/2023
"Pibank sube su cuenta de ahorro hasta el 1,51% TAE, su depósito sigue al 2,52%",https://www.tucapital.es/blogs/noticias/pibank-sube-su-cuenta-de-ahorro-hasta-el-151-tae-su-deposito-sigue-al-252/,04/04/2023
"Sí, BFS ya ofrece más del 3% TAE en sus depósitos",https://www.tucapital.es/depositos/si-bfs-ya-ofrece-mas-del-3-tae-en-sus-depositos/,03/04/2023
"Banca March sube su depósito a 12 meses hasta el 2,3% TAE cancelable",https://www.tucapital.es/depositos/banca-march-sube-su-deposito-a-12-meses-hasta-el-23-tae-cancelable/,31/03/2023
"Evo Banco sube hasta el 1,5% TAE su cuenta Inteligente, pero no a todos",https://www.tucapital.es/cuentas/evo-banco-sube-hasta-el-15-tae-su-cuenta-inteligente/,30/03/2023
"Renault Bank esta vez solo prorroga su cuenta al 1,81% TAE y depósito al 3,03% TAE",https://www.tucapital.es/depositos/renault-bank-prorroga-por-15-dias-su-cuenta-al-181-tae-y-deposito-al-303-tae/,30/03/2023
"Openbank sube su depósito a 12 meses hasta el 2,75% TAE, pero…",https://www.tucapital.es/depositos/openbank-sube-su-deposito-a-12-meses-hasta-el-275-tae-pero/,29/03/2023
"Wizink sube su depósito hasta el 3% TAE, a 18 meses y cancelable",https://www.tucapital.es/depositos/wizink-sube-su-deposito-hasta-el-3-tae-a-18-meses-y-cancelable/,29/03/2023
"ING volverá a subir la rentabilidad de la Cuenta Naranja, hasta el 1% TAE",https://www.tucapital.es/cuentas/ing-vuelve-a-subir-la-rentabilidad-de-la-cuenta-naranja-ahora-hasta-el-1-tae/,28/03/2023
"Bank Norwegian ha subido su Cuenta de Ahorro hasta el 2,00% TAE",https://www.tucapital.es/cuentas/bank-norwegian-ha-subido-su-cuenta-de-ahorro-hasta-el-200-tae/,27/03/2023
ING anuncia su depósito al 2% TAE y a 3 meses en su portada. ¿Algo se está cociendo?,https://www.tucapital.es/depositos/ing-anuncia-su-deposito-al-2-tae-y-a-3-meses-en-su-portada/,24/03/2023
Santander seguirá dando 150€ a cambio de nómina hasta el mes de junio de 2023,https://www.tucapital.es/cuentas/santander-seguira-dando-150e-a-cambio-de-nomina-hasta-el-mes-de-junio-de-2023/,24/03/2023
Openbank anda ofreciendo depósitos con extra tipo a clientes: oferta flash al 2% TAE,https://www.tucapital.es/depositos/openbank-anda-ofreciendo-depositos-con-extra-tipo-a-clientes-2-tae/,23/03/2023
"Facto rompe el mercado: 2,5% TAE a 3 meses; 2,75% TAE a 6 meses y 3,25% TAE a 1 año",https://www.tucapital.es/depositos/facto-rompe-el-mercado-25-tae-a-3-meses-275-tae-a-6-meses-y-325-tae-a-1-ano/,23/03/2023
"EBN hace público la subida de rentabilidad de sus depósitos, ahora hasta 3,15% TAE",https://www.tucapital.es/depositos/ebn-hace-publico-la-subida-de-rentabilidad-de-sus-depositos-ahora-hasta-315-tae/,22/03/2023
"Renault Bank sube su cuenta hasta el 1,81% TAE. Sin cambios en su depósito al 3,03% TAE",https://www.tucapital.es/cuentas/renault-bank-sube-su-cuenta-hasta-el-181-tae-sin-cambios-en-su-deposito-al-303-tae/,22/03/2023
Comparativa de los mejores depósitos a 12 meses de plazo de marzo 2023,https://www.tucapital.es/cuentas/los-mejores-depositos-a-12-meses-de-plazo-de-marzo-2023/,21/03/2023
"Depósitos de captación de liquidez de Openbank: 1% TAE a 12 meses y 1,5% TAE a 18 meses",https://www.tucapital.es/depositos/depositos-de-captacion-de-liquidez-de-openbank-1-tae-a-12-meses-y-15-tae-a-18meses/,20/03/2023
"BFS sube un poquito más sus depósitos, ya casi roza el 3% TAE",https://www.tucapital.es/depositos/bfs-sube-un-poquito-mas-sus-depositos-ya-casi-roza-el-3-tae/,17/03/2023
"Sabadell mantiene el 2% TAE en su cuenta Online, pero sube hasta 250€ por nómina",https://www.tucapital.es/cuentas/sabadell-mantiene-el-2-tae-en-su-cuenta-online-pero-sube-hasta-250e-por-nomina/,16/03/2023
"EBN también supera la barrara del 3% TAE, ofreciendo hasta el 3,15% TAE en sus depósitos",https://www.tucapital.es/depositos/ebn-tambien-supera-la-barrara-del-3-tae-ofreciendo-hasta-el-315-tae/,15/03/2023
Unicaja también ofrece una cuenta al 2% TAE pero con condiciones,https://www.tucapital.es/cuentas/unicaja-tambien-ofrece-una-cuenta-al-2-tae-pero-con-condiciones/,15/03/2023
ING lanza un depósito a 3 meses de plazo y al 2% TAE para dinero nuevo,https://www.tucapital.es/depositos/ing-lanza-un-deposito-al-2-tae-a-3-meses-de-plazo-para-dinero-nuevo/,14/03/2023
"TargoBank lanza 3 depósitos de hasta 2,5% TAE cancelables",https://www.tucapital.es/depositos/targobank-lanza-3-depositos-de-hasta-25-tae-cancelables/,14/03/2023
