title,url,date
14.000 clientes de ING han pagado comisiones por tener exceso de saldo,https://www.tucapital.es/cuentas/14-000-clientes-de-ing-han-pagado-comisiones-por-tener-exceso-de-saldo/,16/03/2022
"Evo Banco también te permite transferir dinero a Ucrania sin coste, ya con 4 bancos",https://www.tucapital.es/cuentas/evo-banco-tambien-te-permite-transferir-dinero-a-ucrania-sin-coste-ya-con-4-bancos/,15/03/2022
Evo Banco regala 5€ por hacer una compra en comercio electrónico con Bizum,https://www.tucapital.es/cuentas/evo-banco-regala-5e-por-hacer-una-compra-en-comercio-electronico-con-bizum/,14/03/2022
"Bankinter amplia hasta junio de 2022 el 5% TAE de su cuenta Nómina, Pensión y No Nómina",https://www.tucapital.es/cuentas/bankinter-amplia-hasta-junio-de-2022-el-5-tae-de-su-cuenta-nomina-pension-y-no-nomina/,11/03/2022
Openbank ofrece a los refugiados ucranianos una cuenta básica sin coste,https://www.tucapital.es/cuentas/openbank-ofrece-a-los-refugiados-ucranianos-una-cuenta-basica-sin-coste/,10/03/2022
Santander ofrece 100€ a cambio de nómina. Hasta el 31 de marzo,https://www.tucapital.es/cuentas/santander-ofrece-100e-a-cambio-de-nomina-hasta-el-31-de-marzo/,09/03/2022
"A partir del próximo jueves, EBN permitirá nuevas imposiciones en sus depósitos",https://www.tucapital.es/depositos/a-partir-del-proximo-jueves-ebn-permite-nuevas-imposiciones-en-sus-depositos/,08/03/2022
Tienes que presentar el modelo 720 antes de 31 de marzo a pesar del TJUE,https://www.tucapital.es/blogs/noticias/tienes-que-presentar-el-modelo-720-antes-de-31-de-marzo-a-pesar-del-tjue/,07/03/2022
ING también se suma a la oferta de comisión 0 para transferencias a Ucrania,https://www.tucapital.es/blogs/noticias/ing-tambien-se-suma-a-la-oferta-de-comision-0-para-transferencias-a-ucrania/,04/03/2022
Openbank y BBVA ofrecen transferencias sin comisiones a Ucrania,https://www.tucapital.es/blogs/noticias/varios-bancos-ofrecen-transferencias-sin-comisiones-a-ucrania/,03/03/2022
¿Es saludable el gaming para la sociedad?,https://www.tucapital.es/blogs/guias/es-saludable-el-gaming-para-la-sociedad/,03/03/2022
La mejores cuentas de ahorro de marzo de 2022: ¿Orange Bank o MyInvestor?,https://www.tucapital.es/cuentas/la-mejores-cuentas-de-ahorro-de-marzo-de-2022-orange-bank-o-myinvestor/,02/03/2022
"¿Santander, BBVA y Sabadell ofrece una cuenta Sin comisiones y sin condiciones? Sí, ¿raro?",https://www.tucapital.es/cuentas/santander-bbva-y-sabadell-ofrece-una-cuenta-sin-comisiones-y-sin-condiciones-raro-pero-si/,28/02/2022
Últimos días del Plan Amigo ING: 40€ por abrir cuenta con la ayuda de un cliente,https://www.tucapital.es/cuentas/ultimos-dias-del-plan-amigo-ing-40e-por-abrir-cuenta-con-la-ayuda-de-un-cliente/,24/02/2022
Últimos días: 25€ en Cheque Amazon por contratar un Fondo en EBN,https://www.tucapital.es/blogs/noticias/ultimos-dias-25e-en-cheque-amazon-por-contratar-un-fondo-en-ebn/,23/02/2022
"Nickel, tu banco en un estanco. ¿Triunfará?",https://www.tucapital.es/blogs/noticias/nickel-tu-banco-en-un-estanco-triunfara/,22/02/2022
"El modelo 720 seguirá siendo obligatorio, sólo bajarán las sanciones",https://www.tucapital.es/blogs/noticias/el-modelo-720-seguira-siendo-obligatorio-solo-bajaran-las-sanciones/,21/02/2022
"La comisión por ingreso en efectivo en ventanilla, nula, por abusiva",https://www.tucapital.es/blogs/noticias/la-comision-por-ingreso-en-efectivo-en-ventanilla-nula-por-abusiva/,17/02/2022
"Lo más rentable para los ahorradores, cuenta MyInvestor al 1% TAE, con peros",https://www.tucapital.es/cuentas/lo-mas-rentable-para-los-ahorradores-cuenta-myinvestor-al-1-tae-con-peros/,16/02/2022
"Liberbank, como BBVA, Santander y Sabadell, también tiene cuenta online sin comisiones",https://www.tucapital.es/cuentas/liberbank-como-bbva-santander-y-sabadell-tambien-tiene-cuenta-online-sin-comisiones/,15/02/2022
"Depósito Wizink de hasta 0,35% TAE. Lamentablemente, es de los más rentables",https://www.tucapital.es/depositos/deposito-wizink-de-hasta-035-tae-lamentablemente-es-de-los-mas-rentables/,14/02/2022
Estas son las 7 cuentas que ofrecen dinero por tu nómina: ranking febrero 2022,https://www.tucapital.es/cuentas/estas-son-las-6-cuentas-que-ofrecen-dinero-por-tu-nomina-ranking-febrero-2022/,11/02/2022
En febrero también puedes conseguir 60€ por contratar la tarjeta gratis de Wizink,https://www.tucapital.es/blogs/noticias/en-febrero-tambien-puedes-conseguir-60e-por-contratar-la-tarjeta-gratis-de-wizink/,09/02/2022
"Orange descataloga la tarifa Llama y complica el alta en la cuenta al 0,5% TAE de Orange Bank",https://www.tucapital.es/cuentas/orange-descataloga-la-tarifa-llama-y-el-alta-en-la-cuenta-al-05-tae-de-orange-bank/,08/02/2022
… y 100€ por domiciliar una nómina o pensión de al menos 800€ (Plan amigo BBVA),https://www.tucapital.es/cuentas/bbva-plan-amigo-y-100e-por-domiciliar-una-nomina-de-al-menos-800e/,07/02/2022
BBVA también tiene Plan Amigo: 15€ por abrir cuenta online sin comisiones,https://www.tucapital.es/cuentas/bbva-tambien-tiene-plan-amigo-15e-por-abrir-cuenta-online-sin-comisiones/,03/02/2022
"ING amplia su plan amigo al mes de Febrero de 2022, 40€ para cada uno",https://www.tucapital.es/cuentas/ing-amplia-su-plan-amigo-al-mes-de-febrero-de-2022-40e-para-cada-uno/,03/02/2022
Comparativa cuenta Online BBVA vs Santander vs Sabadell. Sin comisiones,https://www.tucapital.es/cuentas/comparativa-cuenta-online-bbva-vs-santander-vs-sabadell-sin-comisiones/,02/02/2022
Sabadell saca la cuenta Expansión Digital similar a la cuenta online de BBVA o Santander,https://www.tucapital.es/cuentas/sabadell-saca-la-cuenta-expansion-digital-sin-comisiones-similar-a-la-cuenta-online-de-bbva-o-santander/,01/02/2022
"Hoy, último día para el Plan Amigo ING, 40€ de bonificación",https://www.tucapital.es/cuentas/hoy-ultimo-dia-para-el-plan-amigo-ing-40e-de-bonificacion/,31/01/2022
Modelo 720 declarado ilegal por la Justicia Europea,https://www.tucapital.es/blogs/noticias/modelo-720-declarado-ilegal-por-la-justicia-europea/,27/01/2022
Últimos días para conseguir 20€ de bienvenida en Orange Bank,https://www.tucapital.es/cuentas/ultimos-dias-para-conseguir-20e-de-bienvenida-en-orange-bank/,26/01/2022
4 tendencias fintech para 2022,https://www.tucapital.es/blogs/guias/4-tendencias-fintech-para-2022/,25/01/2022
Nueva APP y Web de ING. ¿Habrá tantas quejas como la vez anterior?,https://www.tucapital.es/cuentas/nueva-app-y-web-de-ing-no-habra-tantos-quejas-como-la-vez-anterior/,25/01/2022
"Tuviste dinero en Raisin, NN Bank… en 2021. Abierto plazo para presentar el modelo 720",https://www.tucapital.es/blogs/noticias/tuviste-dinero-en-raisin-nn-bank-en-2021-abierto-plazo-para-presentar-el-modelo-720/,24/01/2022
Raisin ofrece hasta 200€ de bienvenida a los nuevos clientes que contraten depósitos,https://www.tucapital.es/depositos/raisin-ofrece-hasta-200e-de-bienvenida-a-los-nuevos-clientes-que-contraten-depositos/,21/01/2022
Error liquidación intereses en Renault Bank. ¿Qué ha pasado pasando?,https://www.tucapital.es/cuentas/fallo-pago-de-intereses-en-renault-bank-que-esta-pasando/,20/01/2022
"Los desempleados cobrarán ya 463€ al mes de Subsidio o RAI en Enero de 2022, 11€ más",https://www.tucapital.es/blogs/noticias/los-desempleados-cobraran-ya-463e-al-mes-de-subsidio-o-rai-en-enero-de-2022-11e-mas/,19/01/2022
"Vuelve el Plan Amigo a ING, pero sólo dará 40€ a cada uno",https://www.tucapital.es/cuentas/vuelve-el-plan-amigo-a-ing-pero-solo-dara-40e-a-cada-uno/,18/01/2022
"El tipo de interés legal y de demora seguirán igual en 2022: al 3% y 3,75%",https://www.tucapital.es/blogs/noticias/el-tipo-de-interes-legal-y-de-demora-seguira-igual-en-2022-al-3-y-375/,17/01/2022
Hasta el 31 de Enero: 20€ de bienvenida en Orange Bank y después 16€ al mes en intereses,https://www.tucapital.es/cuentas/hasta-el-31-de-enero-20e-de-bienvenida-en-orange-bank-y-despues-16e-al-mes-en-intereses/,14/01/2022
Comparativa Orange Bank vs MyInvestor en 2022.,https://www.tucapital.es/cuentas/comparativa-orange-bank-vs-myinvestor-en-2022/,13/01/2022
100+ de nuestros usuarios ya tienen sus 60€ en Amazon por contratar la Tarjeta de Wizink,https://www.tucapital.es/blogs/noticias/al-menos-100-de-nuestros-usuarios-ya-tienen-sus-60e-en-amazon-al-contratar-la-tarjeta-de-wizink/,12/01/2022
Santander sigue dando 100€ a cambio de nómina hasta marzo 2022,https://www.tucapital.es/cuentas/santander-sigue-dando-100e-a-cambio-de-nomina-hasta-marzo-2022/,11/01/2022
"Esta semana, Pibank pagará al 0,3% TAE, la Cuenta Nómina y 0,2% TAE, la Cuenta Ahorro",https://www.tucapital.es/cuentas/esta-semana-pibank-pagara-al-03-tae-la-cuenta-nomina-y-02-tae-la-cuenta-ahorro/,10/01/2022
Cajamar amplia también hasta febrero su oferta de 200€ a cambio de nómina,https://www.tucapital.es/cuentas/cajamar-amplia-tambien-hasta-febrero-su-oferta-de-200e-a-cambio-de-nomina/,04/01/2022
10 Dudas Resueltas Sobre ACCIONES,https://www.tucapital.es/blogs/guias/10-dudas-resueltas-sobre-acciones/,04/01/2022
Abanca sigue dando 150€ (o 300€) a cambio de nómina hasta febrero de 2022,https://www.tucapital.es/cuentas/abanca-sigue-dando-150e-o-300e-a-cambio-de-nomina-hasta-febrero-de-2022/,03/01/2022
¿Activo Bank echará el cierre? Ya no se puede contratar la cuenta Activa,https://www.tucapital.es/cuentas/activo-bank-echara-el-cierre-ya-no-se-puede-contratar-la-cuenta-activa/,30/12/2021
Openbank adelanta el pago de la prestación por hijo a cargo o la ayuda de los puntos,https://www.tucapital.es/blogs/noticias/openbank-adelanta-el-pago-de-la-prestacion-por-hijo-a-cargo-o-la-ayuda-de-los-puntos/,29/12/2021
Estas serán las mejores cuentas sin comisiones y sin vinculaciones del 2022,https://www.tucapital.es/cuentas/estas-seran-las-mejores-cuentas-sin-comisiones-y-sin-vinculaciones-del-2022/,28/12/2021
"60€ en Amazon y 3% de cashback, sólo por contratar Tarjeta Me de Wizink",https://www.tucapital.es/blogs/noticias/60e-en-amazon-y-3-de-cashback-solo-por-contratar-tarjeta-me-de-wizink/,27/12/2021
"Bankinter amplia hasta marzo de 2022 el 5% TAE de su cuenta Nómina, Pensión y No Nómina",https://www.tucapital.es/cuentas/bankinter-amplia-hasta-marzo-de-2022-el-5-tae-de-su-cuenta-nomina-pension-y-sin-nomina/,23/12/2021
¡ING echa el cierre… en Francia! ¿y en España?,https://www.tucapital.es/cuentas/ing-echa-el-cierre-en-francia-y-en-espana/,22/12/2021
Conseguir realizar transferencias inmediatas sin coste en Openbank y otros gracias a Bizum,https://www.tucapital.es/cuentas/conseguir-realizar-transferencias-inmediatas-sin-coste-en-openbank-gracias-a-bizum/,21/12/2021
Santander One ofrece 100€ a cambio de nómina hasta 31 de Diciembre 2021 prorrogable,https://www.tucapital.es/cuentas/santander-one-ofrece-100e-a-cambio-de-nomina-hasta-31-de-diciembre-2021-prorrogable/,20/12/2021
Openbank vuelve a ofrece dinero efectivo (20€) por abrir cuenta «1 año después»,https://www.tucapital.es/cuentas/openbank-vuelve-a-ofrece-dinero-efectivo-20e-por-abrir-cuenta-1-ano-despues/,17/12/2021
"Comparativa cuenta Online BBVA vs Santander, sin comisiones",https://www.tucapital.es/cuentas/comparativa-cuenta-online-bbva-vs-santander-sin-comisiones/,16/12/2021
Unicaja te regala la camiseta oficial del Real Madrid o 150€ a cambio de nómina,https://www.tucapital.es/cuentas/unicaja-te-regala-la-camiseta-oficial-del-real-madrid-o-150e-a-cambio-de-nomina/,14/12/2021
¿Qué fue de Cuenta Facto? El banco italiano que ofrecía depósitos muy rentables,https://www.tucapital.es/cuentas/que-fue-de-cuenta-facto-el-banco-italiano-que-ofrecia-depositos-muy-rentables/,13/12/2021
"En Pibank en 1 mes, la Cuenta Nómina al 0,3% TAE y Cuenta Ahorro al 0,2% TAE",https://www.tucapital.es/cuentas/en-pibank-en-1-mes-la-cuenta-nomina-al-03-tae-y-cuenta-ahorro-al-02-tae/,10/12/2021
"Las cuentas de ahorro más rentables de diciembre 2021, hasta el 1% TAE",https://www.tucapital.es/cuentas/las-cuentas-de-ahorro-mas-rentables-de-diciembre-2021-hasta-el-1-tae/,09/12/2021
Ibercaja amplia hasta el 31/12 su oferta de 150€ a cambio de una nómina de 1.500€,https://www.tucapital.es/cuentas/ibercaja-amplia-hasta-el-31-12-su-oferta-de-150e-a-cambio-de-una-nomina-de-1-500e/,07/12/2021
"Orange Bank ya sólo remunera al 0,5% TAE su cuenta, pero hasta 40.000€",https://www.tucapital.es/cuentas/orange-bank-ya-solo-remunera-al-05-tae-su-cuenta-pero-hasta-40-000e/,02/12/2021
Los 60€ de bienvenida por contratar tarjeta gratis de Wizink sigue en vigor,https://www.tucapital.es/blogs/noticias/los-60e-de-bienvenida-por-contratar-tarjeta-gratis-de-wizink-sigue-en-vigor/,01/12/2021
"NN Bank limita a 50.000€ la rentabilidad de su cuenta al 0,2% TAE + Plan Amigo",https://www.tucapital.es/cuentas/nn-bank-limita-a-50-000e-la-rentabilidad-de-su-cuenta-al-02-tae-plan-amigo/,30/11/2021
¿Cómo elegir un intermediario de crédito inmobiliario?,https://www.tucapital.es/blogs/guias/como-elegir-un-intermediario-de-credito-inmobiliario/,30/11/2021
"En 3 días, todas las cuentas de Renault Bank al 0,3% TAE",https://www.tucapital.es/cuentas/en-3-dias-todas-las-cuentas-de-renault-bank-al-03-tae/,29/11/2021
Estas son las 7 cuentas que ofrecen dinero por tu nómina: ranking noviembre 2021,https://www.tucapital.es/cuentas/estas-son-las-7-cuentas-que-ofrecen-dinero-por-tu-nomina-ranking-noviembre-2021/,26/11/2021
¿Merece la pensa mover tu dinero a una cuenta que te sólo 10/20/100€ de intereses al año?,https://www.tucapital.es/cuentas/merece-la-pensa-mover-tu-dinero-a-una-cuenta-que-te-solo-10-20-100e-de-intereses-al-ano/,25/11/2021
Orange Bank te da 20€ de bienvenida y 16€ al mes en intereses,https://www.tucapital.es/cuentas/orange-bank-te-da-20e-de-bienvenida-16e-al-mes-en-intereses/,24/11/2021
Black Friday Evo Banco: reembolso 4% en Booking y 3% bonificación en Cheque Amazon,https://www.tucapital.es/blogs/noticias/black-friday-evo-banco-reembolso-4-en-booking-y-3-bonificacion-en-cheque-amazon/,23/11/2021
"Cobro la Renta Mínima o menos del SMI, ¿me pueden embargar el dinero de la cuenta?",https://www.tucapital.es/blogs/noticias/cobro-la-renta-minima-o-menos-del-smi-me-pueden-embargar-el-dinero-de-la-cuenta/,22/11/2021
Contrata la tarjeta Wizink gratis y gana 60€ en cheque Amazon,https://www.tucapital.es/blogs/noticias/contrata-la-tarjeta-wizink-gratis-y-gana-60e-en-cheque-amazon/,19/11/2021
"Los subsidios y la RAI serán de 463€ al mes en 2022, 11€ más",https://www.tucapital.es/blogs/noticias/los-subsidios-y-la-rai-seran-de-463e-al-mes-en-2022-11e-mas/,18/11/2021
Depósitos EBN: NO cancelable por ti; SÍ cancelable por el banco,https://www.tucapital.es/depositos/depositos-ebn-no-cancelable-por-ti-si-cancelable-por-el-banco/,17/11/2021
"Vuelven los depósitos a EBN Banco, hasta 0,6% TAE",https://www.tucapital.es/depositos/vuelven-los-depositos-a-ebn-banco-hasta-06-tae/,16/11/2021
¿BBVA y Santander ofrecen una cuenta sin comisiones y sin condiciones?,https://www.tucapital.es/cuentas/bbva-y-santander-ofrecen-una-cuenta-sin-comisiones-y-sin-condiciones/,15/11/2021
"Estaba claro, la Cuenta Remunerada de Pibank bajará hasta el 0,2% TAE en Enero",https://www.tucapital.es/cuentas/estaba-claro-la-cuenta-remunerada-de-pibank-bajara-hasta-el-02-tae-en-enero/,12/11/2021
Aún quedan mes y medio para el Plan Amigo Bankinter: 50€+50€ y 5% TAE,https://www.tucapital.es/cuentas/aun-quedan-mes-y-medio-para-el-plan-amigo-bankinter-50e50e-y-5-tae/,11/11/2021
"Clientes de Bankia: próximo fin de semana nuevas comisiones y sin Bizum, ni transferencias",https://www.tucapital.es/cuentas/clientes-de-bankia-proximo-fin-de-semana-nuevas-comisiones-y-sin-bizum-ni-transferencias/,09/11/2021
Ibercaja ofrece 30 de noviembre de 2021 150€ a cambio de una nómina de 1.500€,https://www.tucapital.es/cuentas/ibercaja-ofrece-30-de-noviembre-de-2021-150e-a-cambio-de-una-nomina-de-1-500e/,08/11/2021
Renault Bank comenzará a liquidar intereses mensualmente,https://www.tucapital.es/cuentas/renault-bank-comenzara-a-liquidar-intereses-mensualmente/,05/11/2021
"EBN Banco bajará hasta el 0,05% TAE su cuenta de ahorro en enero de 2022",https://www.tucapital.es/cuentas/ebn-banco-bajara-hasta-el-005-tae-su-cuenta-de-ahorro-en-enero-de-2022/,04/11/2021
"…y esto es lo que ofrecen los otros bancos por tu nómina, hasta 350€",https://www.tucapital.es/cuentas/y-esto-es-lo-que-ofrecen-los-otros-bancos-por-tu-nomina/,03/11/2021
Ahora Santander da 100€ si llevas tu nómina. Un desastre de política de comisiones,https://www.tucapital.es/cuentas/ahora-santander-da-100e-si-llevas-tu-nomina-un-desastre-de-politica-de-comisiones/,02/11/2021
"BFS ofrece en noviembre depósitos de hasta 0,65% TAE",https://www.tucapital.es/depositos/bfs-ofrece-en-noviembre-depositos-de-hasta-065-tae/,02/11/2021
¿Cómo transferir dinero de forma instantánea entre tus cuenta con Bizum?,https://www.tucapital.es/blogs/noticias/como-transferir-dinero-de-forma-instantanea-entre-tus-cuenta-con-bizum/,29/10/2021
OrangeBank te da 20€ por abrir su cuenta al 1% TAE y usar su tarjeta hasta enero 2022,https://www.tucapital.es/cuentas/orangebank-te-da-20e-por-abrir-su-cuenta-al-1-tae-y-usar-su-tarjeta-hasta-enero-2022/,28/10/2021
¿Quieres saber cómo funcionan las transferencias? ¿Cuándo llega a su destino?,https://www.tucapital.es/blogs/noticias/quieres-saber-como-funcionan-las-transferencias-cuando-llega-a-su-destino/,26/10/2021
60€ en cheque Amazon sólo por contratar una tarjeta gratis de Wizink,https://www.tucapital.es/blogs/noticias/60e-en-cheque-amazon-solo-por-contratar-una-tarjeta-gratis-de-wizink/,25/10/2021
¿Qué tal es la nueva cuenta online del Santander? ¿sin comisiones y sin vinculaciones?,https://www.tucapital.es/cuentas/que-tal-es-la-nueva-cuenta-online-del-banco-santander/,21/10/2021
Lista y comparativa de bancos sin comisiones y sin vinculaciones,https://www.tucapital.es/cuentas/lista-y-comparativa-de-bancos-sin-comisiones-y-sin-vinculaciones/,19/10/2021
Estos son los métodos de pago online más populares en España,https://www.tucapital.es/blogs/guias/estos-son-los-metodos-de-pago-online-mas-populares-en-espana/,19/10/2021
Openbank da hasta 600€ por contratar o traspasar un fondo. 100€ por 10.000€,https://www.tucapital.es/blogs/noticias/openbank-da-hasta-600e-por-contratar-o-traspasar-un-fondo-100e-por-10-000e/,15/10/2021
¿Con un cheque Amazon se compra todo? Eso piensan los bancos,https://www.tucapital.es/blogs/noticias/con-un-cheque-amazon-se-compra-todo-eso-piensan-los-bancos/,14/10/2021
"Te quedan 10 días para renovar al 0,4% TAE tus depósitos en Pibank",https://www.tucapital.es/cuentas/te-queda-10-dias-para-renovar-al-04-tae-tus-depositos-en-pibank/,13/10/2021
Tu nómina vale dinero: hasta 5 bancos te lo ofrecen en el mes de octubre,https://www.tucapital.es/cuentas/tu-nomina-vale-dinero-hasta-5-bancos-te-lo-ofrecen-en-el-mes-de-octubre/,11/10/2021
Juegos para mantener tu cerebro activo,https://www.tucapital.es/blogs/guias/juegos-para-mantener-tu-cerebro-activo/,11/10/2021
Estos son los juegos de casino online que nunca aburren,https://www.tucapital.es/blogs/guias/estos-son-los-juegos-de-casino-online-que-nunca-aburren/,11/10/2021
BFS ya está bajo el FGD portugués y sus depósitos son aún menos rentables,https://www.tucapital.es/depositos/bfs-ya-esta-bajo-el-fgd-portugues-y-sus-depositos-son-aun-menos-rentables/,08/10/2021
Abanca sigue dando 300€ (o 150€) a cambio de nómina hasta diciembre de 2021,https://www.tucapital.es/cuentas/abanca-sigue-dando-300e-o-150e-a-cambio-de-nomina-hasta-diciembre-de-2021/,07/10/2021
"EBN permite a sus clientes renovar sus depósitos sin vinculaciones, solo hasta el 0,6% TAE",https://www.tucapital.es/depositos/ebn-permite-a-sus-clientes-renovar-sus-depositos-sin-vinculaciones-solo-hasta-el-06-tae/,06/10/2021
"Las cuentas de ahorro más rentables de octubre 2021, hasta el 1% TAE",https://www.tucapital.es/blogs/noticias/las-cuentas-de-ahorro-mas-rentables-de-octubre-2021-hasta-el-1-tae/,05/10/2021
Bankinter sigue dando un 5% TAE (desde 2012) y 50€ por el plan amigo,https://www.tucapital.es/cuentas/bankinter-sigue-dando-un-5-tae-desde-2012-y-50e-por-el-plan-amigo/,04/10/2021
OrangeBank vuelve a ofrecer 20€ por abrir cuenta y usar su tarjeta,https://www.tucapital.es/cuentas/orangebank-vuelve-a-ofrecer-20e-por-abrir-cuenta-y-usar-la-tarjeta/,01/10/2021
Wizink sigue en octubre regalando 60€ en Amazon a cambio de contratar su tarjeta gratis,https://www.tucapital.es/blogs/noticias/wizink-sigue-en-octubre-regalando-60e-en-amazon-a-cambio-de-contratar-su-tarjeta-gratis/,01/10/2021
"Renault Bank baja de nuevo su cuenta contigo (0,3% TAE), y mantiene en 0,5% TAE su depósito",https://www.tucapital.es/cuentas/renault-bank-baja-su-cuenta-hasta-el-03-tae-y-mantiene-en-05-tae-su-deposito/,30/09/2021
Cajamar te regala 200€ si domicilias una nómina en la entidad hasta diciembre,https://www.tucapital.es/cuentas/cajamar-te-regala-200e-si-domicilias-una-nomina-en-la-entidad-hasta-diciembre/,29/09/2021
Las mejores ofertas de captación de nómina de los bancos de septiembre 2021,https://www.tucapital.es/cuentas/las-mejores-ofertas-de-captacion-de-nomina-de-los-bancos-de-septiembre/,28/09/2021
El movido camino del Bitcoin en tiempos post-pandemia,https://www.tucapital.es/blogs/guias/el-movido-camino-del-bitcoin-en-tiempos-post-pandemia/,28/09/2021
En 1 semana tu dinero en BFS estará bajo el FGD portugués,https://www.tucapital.es/bancos/fgd-fondo-de-garantia-de-depositos/en-1-semana-tu-dinero-en-bfs-estara-bajo-el-fgd-portugues/,24/09/2021
"Pibank baja hasta 0,25% TAE su depósito, en peligro el 0,3% de su cuenta remunerada",https://www.tucapital.es/depositos/pibank-baja-hasta-02-tae-su-deposito-en-peligro-el-03-de-su-cuenta-remunerada/,23/09/2021
Comparativa Cuenta Online sin comisiones/condiciones BBVA vs Santander,https://www.tucapital.es/cuentas/comparativa-cuenta-online-sin-comisiones-condiciones-bbva-vs-santander/,22/09/2021
"Banco Big, uno de los pocos bancos que siguen dando depósitos al 1%  TAE",https://www.tucapital.es/depositos/banco-big-uno-de-los-pocos-bancos-que-siguen-dando-un-1-tae/,21/09/2021
Santander saca una cuenta Online sin comisiones y sin condiciones al estilo de BBVA,https://www.tucapital.es/cuentas/santander-saca-una-cuenta-online-sin-comisiones-y-sin-condiciones-al-estilo-de-bbva/,20/09/2021
"Renault Bank NO «está actualizando» su sistema. Es un fallo, ¿Cómo solucionarlo?",https://www.tucapital.es/cuentas/renault-bank-no-esta-actualizando-su-sistema-es-un-fallo-como-solucionarlo/,20/09/2021
"Renault Bank (con cuenta al 0,5% TAE) nuevamente con problemas técnicos",https://www.tucapital.es/cuentas/renault-bank-nuevamente-con-problemas-tecnicos/,17/09/2021
«Orange Bank se hace mayor»: quiere captar tu nómina y bajarte la rentabilidad,https://www.tucapital.es/cuentas/orange-bank-se-hace-mayor-quiere-captar-tu-nomina-y-bajarte-la-rentabilidad/,16/09/2021
Para Abanca la nómina tiene diferente valor si vives en Madrid o Asturias: 300€ vs 150€,https://www.tucapital.es/cuentas/para-abanca-la-nomina-tiene-diferente-valor-si-vives-en-madrid-o-asturias-300e-vs-150e/,15/09/2021
Comparativa Orange Bank vs MyInvestor tras el tijeretazo de Orange Bank,https://www.tucapital.es/cuentas/comparativa-orange-bank-vs-myinvestor-tras-el-tijeretazo-de-orange-bank/,14/09/2021
"Se acabará el chollo del 1% TAE en Orange Bank a partir de diciembre de 2021, tijeretazo",https://www.tucapital.es/cuentas/se-acabara-el-chollo-del-1-tae-en-orange-bank-a-partir-de-diciembre-de-2021-tijeretazo/,13/09/2021
"Clientes de la Cuenta On de Bankia, Caixa Bank te cobrará además 36€ por la tarjeta de débito",https://www.tucapital.es/cuentas/clientes-de-la-cuenta-on-de-bankia-caixa-bank-te-cobrar-36e-por-la-tarjeta-de-debito/,10/09/2021
Consigue 60€ en Amazon contratando una tarjeta gratis en Wizink y con ventajas,https://www.tucapital.es/blogs/noticias/consigue-60e-en-amazon-contratando-una-tarjeta-gratis-en-wizink-y-con-ventajas/,09/09/2021
11 alternativas sin vinculaciones y sin comisiones para clientes de la Cuenta On de Caixa Bank,https://www.tucapital.es/cuentas/11-alternativas-sin-vinculaciones-y-sin-comisiones-para-clientes-de-la-cuenta-on-de-caixa-bank/,08/09/2021
Huye de CaixaBank si tienes la Cuenta On de Bankia. Hasta 240€ de comisión al año,https://www.tucapital.es/cuentas/huye-de-caixabank-si-tienes-la-cuenta-on-de-bankia-hasta240e-de-comision-al-ano/,07/09/2021
BBVA regala 100€ por domiciliar una nómina de 800€ o una pensión de 300€,https://www.tucapital.es/cuentas/bbva-regala-100e-por-domiciliar-una-nomina-de-800e-o-una-pension-de-300e/,06/09/2021
El 1% TAE de Orange Bank y MyInvestor son los más rentables de septiembre de 2021,https://www.tucapital.es/cuentas/el-1-tae-de-orange-bank-y-myinvestor-son-los-mas-rentables-de-septiembre-de-2021/,03/09/2021
Consigue 15€ por abrir la Cuenta Online Gratuita de BBVA con la ayuda de un «amigo»,https://www.tucapital.es/cuentas/consigue-15e-por-abrir-la-cuenta-online-gratuita-de-bbva-con-la-ayuda-de-un-amigo/,02/09/2021
Tijeretazo en Wizink: afecta a todos sus productos de ahorro,https://www.tucapital.es/depositos/tijeretazo-en-wizink-afecta-a-todos-sus-productos-de-ahorro/,01/09/2021
CaixaBank: Los clientes de Bankia tendrán que pagar 36€ al año por la tarjeta de débito,https://www.tucapital.es/cuentas/caixabank-los-clientes-de-bankia-tendran-que-pagar-36e-al-ano-por-la-tarjeta-de-debito/,31/08/2021
"Últimos días al 0,2% TAE de la Cuenta Wizink de antiguos clientes, 1/9 al 0,05% TAE",https://www.tucapital.es/cuentas/ultimos-dias-al-02-tae-de-la-cuenta-wizink-de-antiguos-clientes-1-9-al-005-tae/,30/08/2021
